{
  "user_email": "a4444b6514c91a6b1addfb4e79abf20b5f0433abc3dab51a28bd5736f4ec72c4",
  "user_id": "a4444b6514c91a6b1addfb4e79abf20b5f0433abc3dab51a28bd5736f4ec72c4_1763552756943",
  "account_created": "2025-11-19T11:45:56.943Z",
  "last_sync": "2025-11-19T11:45:56.943Z",
  "total_sessions": 41,
  "total_scans": 648,
  "sessions": [
    {
      "id": "scanner1757849083219",
      "location": "Physiology",
      "year": 2,
      "batch": "2025/2026",
      "dateTime": "2025-09-14T11:24:43.219Z",
      "formattedDateTime": "14/09/2025 14:24:43",
      "scans": [],
      "inProgress": false,
      "isScanner": true,
      "sessionType": "scanner",
      "recoveryStatus": "interrupted",
      "isChecklist": false,
      "user_email": "a4444b6514c91a6b1addfb4e79abf20b5f0433abc3dab51a28bd5736f4ec72c4",
      "user_id": "a4444b6514c91a6b1addfb4e79abf20b5f0433abc3dab51a28bd5736f4ec72c4_1763552756943",
      "created_by": "a4444b6514c91a6b1addfb4e79abf20b5f0433abc3dab51a28bd5736f4ec72c4",
      "created_at": "2025-11-19T11:45:56.943Z",
      "updated_at": "2025-11-19T11:45:56.943Z"
    },
    {
      "id": "scanner1758451571973",
      "location": "Physiology",
      "year": 2,
      "batch": "2025/2026",
      "dateTime": "2025-09-21T10:46:11.973Z",
      "formattedDateTime": "21/09/2025 13:46:11",
      "scans": [],
      "inProgress": false,
      "isScanner": true,
      "sessionType": "scanner",
      "recoveryStatus": "closed_normally",
      "isChecklist": false,
      "backedUp": true,
      "user_email": "a4444b6514c91a6b1addfb4e79abf20b5f0433abc3dab51a28bd5736f4ec72c4",
      "user_id": "a4444b6514c91a6b1addfb4e79abf20b5f0433abc3dab51a28bd5736f4ec72c4_1763552756943",
      "created_by": "a4444b6514c91a6b1addfb4e79abf20b5f0433abc3dab51a28bd5736f4ec72c4",
      "created_at": "2025-11-19T11:45:56.943Z",
      "updated_at": "2025-11-19T11:45:56.943Z"
    },
    {
      "id": "scanner1758451642750",
      "location": "Physiology",
      "year": 2,
      "batch": "2025/2026",
      "dateTime": "2025-09-21T10:47:22.750Z",
      "formattedDateTime": "21/09/2025 13:47:22",
      "scans": [],
      "inProgress": false,
      "isScanner": true,
      "sessionType": "scanner",
      "recoveryStatus": "interrupted",
      "isChecklist": false,
      "user_email": "a4444b6514c91a6b1addfb4e79abf20b5f0433abc3dab51a28bd5736f4ec72c4",
      "user_id": "a4444b6514c91a6b1addfb4e79abf20b5f0433abc3dab51a28bd5736f4ec72c4_1763552756943",
      "created_by": "a4444b6514c91a6b1addfb4e79abf20b5f0433abc3dab51a28bd5736f4ec72c4",
      "created_at": "2025-11-19T11:45:56.943Z",
      "updated_at": "2025-11-19T11:45:56.943Z"
    },
    {
      "id": "scanner1758454952395",
      "location": "Physiology",
      "year": 2,
      "batch": "2025/2026",
      "dateTime": "2025-09-21T11:42:32.395Z",
      "formattedDateTime": "21/09/2025 14:42:32",
      "scans": [
        {
          "id": "1758454953737",
          "content": "241018",
          "timestamp": "2025-09-21T11:42:33.731Z",
          "formattedTime": "14:42:33",
          "time": "2025-09-21T11:42:33.731Z",
          "isManual": false
        },
        {
          "id": "1758454963610",
          "content": "241006",
          "timestamp": "2025-09-21T11:42:43.603Z",
          "formattedTime": "14:42:43",
          "time": "2025-09-21T11:42:43.603Z",
          "isManual": false
        },
        {
          "id": "1758454968297",
          "content": "241020",
          "timestamp": "2025-09-21T11:42:48.274Z",
          "formattedTime": "14:42:48",
          "time": "2025-09-21T11:42:48.274Z",
          "isManual": false
        },
        {
          "id": "1758454971489",
          "content": "241017",
          "timestamp": "2025-09-21T11:42:51.477Z",
          "formattedTime": "14:42:51",
          "time": "2025-09-21T11:42:51.477Z",
          "isManual": false
        },
        {
          "id": "1758454976603",
          "content": "241022",
          "timestamp": "2025-09-21T11:42:56.564Z",
          "formattedTime": "14:42:56",
          "time": "2025-09-21T11:42:56.564Z",
          "isManual": false
        },
        {
          "id": "1758454980203",
          "content": "241004",
          "timestamp": "2025-09-21T11:43:00.183Z",
          "formattedTime": "14:43:00",
          "time": "2025-09-21T11:43:00.183Z",
          "isManual": false
        },
        {
          "id": "1758454983980",
          "content": "241014",
          "timestamp": "2025-09-21T11:43:03.968Z",
          "formattedTime": "14:43:03",
          "time": "2025-09-21T11:43:03.968Z",
          "isManual": false
        },
        {
          "id": "1758454989436",
          "content": "241024",
          "timestamp": "2025-09-21T11:43:09.394Z",
          "formattedTime": "14:43:09",
          "time": "2025-09-21T11:43:09.394Z",
          "isManual": false
        },
        {
          "id": "1758454995869",
          "content": "241010",
          "timestamp": "2025-09-21T11:43:15.859Z",
          "formattedTime": "14:43:15",
          "time": "2025-09-21T11:43:15.859Z",
          "isManual": false
        },
        {
          "id": "1758454998821",
          "content": "241021",
          "timestamp": "2025-09-21T11:43:18.810Z",
          "formattedTime": "14:43:18",
          "time": "2025-09-21T11:43:18.810Z",
          "isManual": false
        },
        {
          "id": "1758455002693",
          "content": "241013",
          "timestamp": "2025-09-21T11:43:22.664Z",
          "formattedTime": "14:43:22",
          "time": "2025-09-21T11:43:22.664Z",
          "isManual": false
        },
        {
          "id": "1758455021048",
          "content": "241019",
          "timestamp": "2025-09-21T11:43:41.043Z",
          "formattedTime": "14:43:41",
          "time": "2025-09-21T11:43:41.043Z",
          "isManual": false
        },
        {
          "id": "1758455023289",
          "content": "241046",
          "timestamp": "2025-09-21T11:43:43.279Z",
          "formattedTime": "14:43:43",
          "time": "2025-09-21T11:43:43.279Z",
          "isManual": false
        },
        {
          "id": "1758455025174",
          "content": "241002",
          "timestamp": "2025-09-21T11:43:45.164Z",
          "formattedTime": "14:43:45",
          "time": "2025-09-21T11:43:45.164Z",
          "isManual": false
        },
        {
          "id": "1758455027192",
          "content": "241012",
          "timestamp": "2025-09-21T11:43:47.181Z",
          "formattedTime": "14:43:47",
          "time": "2025-09-21T11:43:47.181Z",
          "isManual": false
        },
        {
          "id": "1758455036879",
          "content": "241015",
          "timestamp": "2025-09-21T11:43:56.854Z",
          "formattedTime": "14:43:56",
          "time": "2025-09-21T11:43:56.854Z",
          "isManual": false
        },
        {
          "id": "1758455040318",
          "content": "241009",
          "timestamp": "2025-09-21T11:44:00.307Z",
          "formattedTime": "14:44:00",
          "time": "2025-09-21T11:44:00.307Z",
          "isManual": false
        },
        {
          "id": "1758455046466",
          "content": "241016",
          "timestamp": "2025-09-21T11:44:06.445Z",
          "formattedTime": "14:44:06",
          "time": "2025-09-21T11:44:06.445Z",
          "isManual": false
        }
      ],
      "inProgress": false,
      "isScanner": true,
      "sessionType": "scanner",
      "recoveryStatus": "closed_normally",
      "isChecklist": false,
      "backedUp": true,
      "user_email": "a4444b6514c91a6b1addfb4e79abf20b5f0433abc3dab51a28bd5736f4ec72c4",
      "user_id": "a4444b6514c91a6b1addfb4e79abf20b5f0433abc3dab51a28bd5736f4ec72c4_1763552756943",
      "created_by": "a4444b6514c91a6b1addfb4e79abf20b5f0433abc3dab51a28bd5736f4ec72c4",
      "created_at": "2025-11-19T11:45:56.943Z",
      "updated_at": "2025-11-19T11:45:56.943Z"
    },
    {
      "id": "scanner1758458975198",
      "location": "Physiology",
      "year": 2,
      "batch": "2025/2026",
      "dateTime": "2025-09-21T12:49:35.198Z",
      "formattedDateTime": "21/09/2025 15:49:35",
      "scans": [
        {
          "id": "1758458978851",
          "content": "244354",
          "timestamp": "2025-09-21T12:49:38.844Z",
          "formattedTime": "15:49:38",
          "time": "2025-09-21T12:49:38.844Z",
          "isManual": false
        },
        {
          "id": "1758458991892",
          "content": "244581",
          "timestamp": "2025-09-21T12:49:51.869Z",
          "formattedTime": "15:49:51",
          "time": "2025-09-21T12:49:51.869Z",
          "isManual": false
        },
        {
          "id": "1758459013761",
          "content": "244472",
          "timestamp": "2025-09-21T12:50:13.756Z",
          "formattedTime": "15:50:13",
          "time": "2025-09-21T12:50:13.756Z",
          "isManual": false
        },
        {
          "id": "1758459024576",
          "content": "244602",
          "timestamp": "2025-09-21T12:50:24.564Z",
          "formattedTime": "15:50:24",
          "time": "2025-09-21T12:50:24.564Z",
          "isManual": false
        },
        {
          "id": "1758459029018",
          "content": "244624",
          "timestamp": "2025-09-21T12:50:28.987Z",
          "formattedTime": "15:50:28",
          "time": "2025-09-21T12:50:28.987Z",
          "isManual": false
        },
        {
          "id": "1758459035346",
          "content": "244556",
          "timestamp": "2025-09-21T12:50:35.338Z",
          "formattedTime": "15:50:35",
          "time": "2025-09-21T12:50:35.338Z",
          "isManual": false
        },
        {
          "id": "1758459043050",
          "content": "244528",
          "timestamp": "2025-09-21T12:50:43.043Z",
          "formattedTime": "15:50:43",
          "time": "2025-09-21T12:50:43.043Z",
          "isManual": false
        },
        {
          "id": "1758459054592",
          "content": "244428",
          "timestamp": "2025-09-21T12:50:54.584Z",
          "formattedTime": "15:50:54",
          "time": "2025-09-21T12:50:54.584Z",
          "isManual": false
        },
        {
          "id": "1758459055805",
          "content": "244418",
          "timestamp": "2025-09-21T12:50:55.801Z",
          "formattedTime": "15:50:55",
          "time": "2025-09-21T12:50:55.801Z",
          "isManual": false
        },
        {
          "id": "1758459075996",
          "content": "244430",
          "timestamp": "2025-09-21T12:51:15.985Z",
          "formattedTime": "15:51:15",
          "time": "2025-09-21T12:51:15.985Z",
          "isManual": false
        },
        {
          "id": "1758459087621",
          "content": "244183",
          "timestamp": "2025-09-21T12:51:27.609Z",
          "formattedTime": "15:51:27",
          "time": "2025-09-21T12:51:27.609Z",
          "isManual": false
        },
        {
          "id": "1758459096836",
          "content": "244414",
          "timestamp": "2025-09-21T12:51:36.831Z",
          "formattedTime": "15:51:36",
          "time": "2025-09-21T12:51:36.831Z",
          "isManual": false
        },
        {
          "id": "1758459104364",
          "content": "244548",
          "timestamp": "2025-09-21T12:51:44.354Z",
          "formattedTime": "15:51:44",
          "time": "2025-09-21T12:51:44.354Z",
          "isManual": false
        },
        {
          "id": "1758459124105",
          "content": "244335",
          "timestamp": "2025-09-21T12:52:04.098Z",
          "formattedTime": "15:52:04",
          "time": "2025-09-21T12:52:04.098Z",
          "isManual": false
        },
        {
          "id": "1758459126393",
          "content": "244350",
          "timestamp": "2025-09-21T12:52:06.383Z",
          "formattedTime": "15:52:06",
          "time": "2025-09-21T12:52:06.383Z",
          "isManual": false
        },
        {
          "id": "1758459127810",
          "content": "244454",
          "timestamp": "2025-09-21T12:52:07.800Z",
          "formattedTime": "15:52:07",
          "time": "2025-09-21T12:52:07.800Z",
          "isManual": false
        },
        {
          "id": "1758459129915",
          "content": "244516",
          "timestamp": "2025-09-21T12:52:09.902Z",
          "formattedTime": "15:52:09",
          "time": "2025-09-21T12:52:09.902Z",
          "isManual": false
        },
        {
          "id": "1758459132014",
          "content": "244637",
          "timestamp": "2025-09-21T12:52:12.003Z",
          "formattedTime": "15:52:12",
          "time": "2025-09-21T12:52:12.003Z",
          "isManual": false
        },
        {
          "id": "1758459134332",
          "content": "244517",
          "timestamp": "2025-09-21T12:52:14.321Z",
          "formattedTime": "15:52:14",
          "time": "2025-09-21T12:52:14.321Z",
          "isManual": false
        }
      ],
      "inProgress": true,
      "isScanner": true,
      "sessionType": "scanner",
      "recoveryStatus": "in_progress",
      "isChecklist": false,
      "backedUp": true,
      "user_email": "a4444b6514c91a6b1addfb4e79abf20b5f0433abc3dab51a28bd5736f4ec72c4",
      "user_id": "a4444b6514c91a6b1addfb4e79abf20b5f0433abc3dab51a28bd5736f4ec72c4_1763552756943",
      "created_by": "a4444b6514c91a6b1addfb4e79abf20b5f0433abc3dab51a28bd5736f4ec72c4",
      "created_at": "2025-11-19T11:45:56.943Z",
      "updated_at": "2025-11-19T11:45:56.943Z"
    },
    {
      "id": "scanner1758459191363",
      "location": "Physiology",
      "year": 2,
      "batch": "2025/2026",
      "dateTime": "2025-09-21T12:53:11.363Z",
      "formattedDateTime": "21/09/2025 15:53:11",
      "scans": [
        {
          "id": "1758459193520",
          "content": "244421",
          "timestamp": "2025-09-21T12:53:13.515Z",
          "formattedTime": "15:53:13",
          "time": "2025-09-21T12:53:13.515Z",
          "isManual": false
        }
      ],
      "inProgress": true,
      "isScanner": true,
      "sessionType": "scanner",
      "recoveryStatus": "in_progress",
      "isChecklist": false,
      "backedUp": true,
      "user_email": "a4444b6514c91a6b1addfb4e79abf20b5f0433abc3dab51a28bd5736f4ec72c4",
      "user_id": "a4444b6514c91a6b1addfb4e79abf20b5f0433abc3dab51a28bd5736f4ec72c4_1763552756943",
      "created_by": "a4444b6514c91a6b1addfb4e79abf20b5f0433abc3dab51a28bd5736f4ec72c4",
      "created_at": "2025-11-19T11:45:56.943Z",
      "updated_at": "2025-11-19T11:45:56.943Z"
    },
    {
      "id": "scanner1758782941594",
      "location": "Physiology",
      "year": 2,
      "batch": "2025/2026",
      "dateTime": "2025-09-25T06:49:01.594Z",
      "formattedDateTime": "25/09/2025 09:49:01",
      "scans": [
        {
          "id": "1758783173657",
          "content": "221351",
          "timestamp": "2025-09-25T06:52:53.630Z",
          "formattedTime": "09:52:53",
          "time": "2025-09-25T06:52:53.630Z",
          "isManual": false
        },
        {
          "id": "1758783210867",
          "content": "221606",
          "timestamp": "2025-09-25T06:53:30.828Z",
          "formattedTime": "09:53:30",
          "time": "2025-09-25T06:53:30.828Z",
          "isManual": false
        },
        {
          "id": "1758783218513",
          "content": "221574",
          "timestamp": "2025-09-25T06:53:38.496Z",
          "formattedTime": "09:53:38",
          "time": "2025-09-25T06:53:38.496Z",
          "isManual": false
        },
        {
          "id": "1758783248295",
          "content": "221850",
          "timestamp": "2025-09-25T06:54:08.280Z",
          "formattedTime": "09:54:08",
          "time": "2025-09-25T06:54:08.280Z",
          "isManual": false
        }
      ],
      "inProgress": false,
      "isScanner": true,
      "sessionType": "scanner",
      "recoveryStatus": "closed_normally",
      "isChecklist": false,
      "backedUp": true,
      "user_email": "a4444b6514c91a6b1addfb4e79abf20b5f0433abc3dab51a28bd5736f4ec72c4",
      "user_id": "a4444b6514c91a6b1addfb4e79abf20b5f0433abc3dab51a28bd5736f4ec72c4_1763552756943",
      "created_by": "a4444b6514c91a6b1addfb4e79abf20b5f0433abc3dab51a28bd5736f4ec72c4",
      "created_at": "2025-11-19T11:45:56.943Z",
      "updated_at": "2025-11-19T11:45:56.943Z"
    },
    {
      "id": "scanner1759143059644",
      "location": "Physiology",
      "year": 3,
      "batch": "2025/2026",
      "dateTime": "2025-09-29T10:50:59.644Z",
      "formattedDateTime": "29/09/2025 13:50:59",
      "scans": [
        {
          "id": "1759143061677",
          "content": "231245",
          "timestamp": "2025-09-29T10:51:01.672Z",
          "formattedTime": "13:51:01",
          "time": "2025-09-29T10:51:01.672Z",
          "isManual": false
        },
        {
          "id": "1759143063984",
          "content": "231248",
          "timestamp": "2025-09-29T10:51:03.974Z",
          "formattedTime": "13:51:03",
          "time": "2025-09-29T10:51:03.974Z",
          "isManual": false
        },
        {
          "id": "1759143066365",
          "content": "231251",
          "timestamp": "2025-09-29T10:51:06.357Z",
          "formattedTime": "13:51:06",
          "time": "2025-09-29T10:51:06.357Z",
          "isManual": false
        },
        {
          "id": "1759143072210",
          "content": "231249",
          "timestamp": "2025-09-29T10:51:12.198Z",
          "formattedTime": "13:51:12",
          "time": "2025-09-29T10:51:12.198Z",
          "isManual": false
        },
        {
          "id": "1759143074440",
          "content": "231243",
          "timestamp": "2025-09-29T10:51:14.429Z",
          "formattedTime": "13:51:14",
          "time": "2025-09-29T10:51:14.429Z",
          "isManual": false
        },
        {
          "id": "1759143078309",
          "content": "231242",
          "timestamp": "2025-09-29T10:51:18.299Z",
          "formattedTime": "13:51:18",
          "time": "2025-09-29T10:51:18.299Z",
          "isManual": false
        },
        {
          "id": "1759143083136",
          "content": "231228",
          "timestamp": "2025-09-29T10:51:23.121Z",
          "formattedTime": "13:51:23",
          "time": "2025-09-29T10:51:23.121Z",
          "isManual": false
        },
        {
          "id": "1759143085598",
          "content": "231247",
          "timestamp": "2025-09-29T10:51:25.587Z",
          "formattedTime": "13:51:25",
          "time": "2025-09-29T10:51:25.587Z",
          "isManual": false
        },
        {
          "id": "1759143091470",
          "content": "231239",
          "timestamp": "2025-09-29T10:51:31.458Z",
          "formattedTime": "13:51:31",
          "time": "2025-09-29T10:51:31.458Z",
          "isManual": false
        },
        {
          "id": "1759143100086",
          "content": "231237",
          "timestamp": "2025-09-29T10:51:40.078Z",
          "formattedTime": "13:51:40",
          "time": "2025-09-29T10:51:40.078Z",
          "isManual": false
        },
        {
          "id": "1759143102000",
          "content": "231252",
          "timestamp": "2025-09-29T10:51:41.997Z",
          "formattedTime": "13:51:41",
          "time": "2025-09-29T10:51:41.997Z",
          "isManual": false
        },
        {
          "id": "1759143103673",
          "content": "231221",
          "timestamp": "2025-09-29T10:51:43.664Z",
          "formattedTime": "13:51:43",
          "time": "2025-09-29T10:51:43.664Z",
          "isManual": false
        },
        {
          "id": "1759143109614",
          "content": "231227",
          "timestamp": "2025-09-29T10:51:49.603Z",
          "formattedTime": "13:51:49",
          "time": "2025-09-29T10:51:49.603Z",
          "isManual": false
        },
        {
          "id": "1759143197098",
          "content": "231224",
          "timestamp": "2025-09-29T10:53:17.091Z",
          "formattedTime": "13:53:17",
          "time": "2025-09-29T10:53:17.091Z",
          "isManual": false
        },
        {
          "id": "1759143199037",
          "content": "231233",
          "timestamp": "2025-09-29T10:53:19.026Z",
          "formattedTime": "13:53:19",
          "time": "2025-09-29T10:53:19.026Z",
          "isManual": false
        }
      ],
      "inProgress": true,
      "isScanner": true,
      "sessionType": "scanner",
      "recoveryStatus": "in_progress",
      "isChecklist": false,
      "backedUp": true,
      "user_email": "a4444b6514c91a6b1addfb4e79abf20b5f0433abc3dab51a28bd5736f4ec72c4",
      "user_id": "a4444b6514c91a6b1addfb4e79abf20b5f0433abc3dab51a28bd5736f4ec72c4_1763552756943",
      "created_by": "a4444b6514c91a6b1addfb4e79abf20b5f0433abc3dab51a28bd5736f4ec72c4",
      "created_at": "2025-11-19T11:45:56.943Z",
      "updated_at": "2025-11-19T11:45:56.943Z"
    },
    {
      "id": "scanner1759143235807",
      "location": "Physiology",
      "year": 3,
      "batch": "2025/2026",
      "dateTime": "2025-09-29T10:53:55.807Z",
      "formattedDateTime": "29/09/2025 13:53:55",
      "scans": [
        {
          "id": "1759143236871",
          "content": "231232",
          "timestamp": "2025-09-29T10:53:56.866Z",
          "formattedTime": "13:53:56",
          "time": "2025-09-29T10:53:56.866Z",
          "isManual": false
        },
        {
          "id": "1759143246356",
          "content": "231222",
          "timestamp": "2025-09-29T10:54:06.349Z",
          "formattedTime": "13:54:06",
          "time": "2025-09-29T10:54:06.349Z",
          "isManual": false
        },
        {
          "id": "1759143248675",
          "content": "231225",
          "timestamp": "2025-09-29T10:54:08.667Z",
          "formattedTime": "13:54:08",
          "time": "2025-09-29T10:54:08.667Z",
          "isManual": false
        }
      ],
      "inProgress": true,
      "isScanner": true,
      "sessionType": "scanner",
      "recoveryStatus": "in_progress",
      "isChecklist": false,
      "backedUp": true,
      "user_email": "a4444b6514c91a6b1addfb4e79abf20b5f0433abc3dab51a28bd5736f4ec72c4",
      "user_id": "a4444b6514c91a6b1addfb4e79abf20b5f0433abc3dab51a28bd5736f4ec72c4_1763552756943",
      "created_by": "a4444b6514c91a6b1addfb4e79abf20b5f0433abc3dab51a28bd5736f4ec72c4",
      "created_at": "2025-11-19T11:45:56.943Z",
      "updated_at": "2025-11-19T11:45:56.943Z"
    },
    {
      "id": "scanner1759146703301",
      "location": "Physiology",
      "year": 3,
      "batch": "2025/2026",
      "dateTime": "2025-09-29T11:51:43.301Z",
      "formattedDateTime": "29/09/2025 14:51:43",
      "scans": [
        {
          "id": "1759146708172",
          "content": "234159",
          "timestamp": "2025-09-29T11:51:48.163Z",
          "formattedTime": "14:51:48",
          "time": "2025-09-29T11:51:48.163Z",
          "isManual": false
        },
        {
          "id": "1759146710496",
          "content": "234097",
          "timestamp": "2025-09-29T11:51:50.489Z",
          "formattedTime": "14:51:50",
          "time": "2025-09-29T11:51:50.489Z",
          "isManual": false
        },
        {
          "id": "1759146712132",
          "content": "234136",
          "timestamp": "2025-09-29T11:51:52.124Z",
          "formattedTime": "14:51:52",
          "time": "2025-09-29T11:51:52.124Z",
          "isManual": false
        },
        {
          "id": "1759146713353",
          "content": "234117",
          "timestamp": "2025-09-29T11:51:53.342Z",
          "formattedTime": "14:51:53",
          "time": "2025-09-29T11:51:53.342Z",
          "isManual": false
        },
        {
          "id": "1759146714871",
          "content": "234129",
          "timestamp": "2025-09-29T11:51:54.860Z",
          "formattedTime": "14:51:54",
          "time": "2025-09-29T11:51:54.860Z",
          "isManual": false
        },
        {
          "id": "1759146715937",
          "content": "234113",
          "timestamp": "2025-09-29T11:51:55.927Z",
          "formattedTime": "14:51:55",
          "time": "2025-09-29T11:51:55.927Z",
          "isManual": false
        },
        {
          "id": "1759146719387",
          "content": "234163",
          "timestamp": "2025-09-29T11:51:59.378Z",
          "formattedTime": "14:51:59",
          "time": "2025-09-29T11:51:59.378Z",
          "isManual": false
        },
        {
          "id": "1759146721866",
          "content": "234168",
          "timestamp": "2025-09-29T11:52:01.862Z",
          "formattedTime": "14:52:01",
          "time": "2025-09-29T11:52:01.862Z",
          "isManual": false
        },
        {
          "id": "1759146723560",
          "content": "234087",
          "timestamp": "2025-09-29T11:52:03.549Z",
          "formattedTime": "14:52:03",
          "time": "2025-09-29T11:52:03.549Z",
          "isManual": false
        },
        {
          "id": "1759146725555",
          "content": "234176",
          "timestamp": "2025-09-29T11:52:05.549Z",
          "formattedTime": "14:52:05",
          "time": "2025-09-29T11:52:05.549Z",
          "isManual": false
        },
        {
          "id": "1759146727256",
          "content": "234101",
          "timestamp": "2025-09-29T11:52:07.250Z",
          "formattedTime": "14:52:07",
          "time": "2025-09-29T11:52:07.250Z",
          "isManual": false
        },
        {
          "id": "1759146732776",
          "content": "234165",
          "timestamp": "2025-09-29T11:52:12.770Z",
          "formattedTime": "14:52:12",
          "time": "2025-09-29T11:52:12.770Z",
          "isManual": false
        },
        {
          "id": "1759146735285",
          "content": "234141",
          "timestamp": "2025-09-29T11:52:15.273Z",
          "formattedTime": "14:52:15",
          "time": "2025-09-29T11:52:15.273Z",
          "isManual": false
        },
        {
          "id": "1759146737642",
          "content": "234109",
          "timestamp": "2025-09-29T11:52:17.630Z",
          "formattedTime": "14:52:17",
          "time": "2025-09-29T11:52:17.630Z",
          "isManual": false
        },
        {
          "id": "1759146740748",
          "content": "234127",
          "timestamp": "2025-09-29T11:52:20.742Z",
          "formattedTime": "14:52:20",
          "time": "2025-09-29T11:52:20.742Z",
          "isManual": false
        },
        {
          "id": "1759146742313",
          "content": "234108",
          "timestamp": "2025-09-29T11:52:22.308Z",
          "formattedTime": "14:52:22",
          "time": "2025-09-29T11:52:22.308Z",
          "isManual": false
        },
        {
          "id": "1759146743587",
          "content": "234120",
          "timestamp": "2025-09-29T11:52:23.578Z",
          "formattedTime": "14:52:23",
          "time": "2025-09-29T11:52:23.578Z",
          "isManual": false
        },
        {
          "id": "1759146749940",
          "content": "234140",
          "timestamp": "2025-09-29T11:52:29.933Z",
          "formattedTime": "14:52:29",
          "time": "2025-09-29T11:52:29.933Z",
          "isManual": false
        },
        {
          "id": "1759146755916",
          "content": "234133",
          "timestamp": "2025-09-29T11:52:35.888Z",
          "formattedTime": "14:52:35",
          "time": "2025-09-29T11:52:35.888Z",
          "isManual": false
        },
        {
          "id": "1759146758444",
          "content": "234134",
          "timestamp": "2025-09-29T11:52:38.437Z",
          "formattedTime": "14:52:38",
          "time": "2025-09-29T11:52:38.437Z",
          "isManual": false
        },
        {
          "id": "1759146761287",
          "content": "234119",
          "timestamp": "2025-09-29T11:52:41.278Z",
          "formattedTime": "14:52:41",
          "time": "2025-09-29T11:52:41.278Z",
          "isManual": false
        },
        {
          "id": "1759146764838",
          "content": "234107",
          "timestamp": "2025-09-29T11:52:44.826Z",
          "formattedTime": "14:52:44",
          "time": "2025-09-29T11:52:44.826Z",
          "isManual": false
        },
        {
          "id": "1759146782778",
          "content": "234177",
          "timestamp": "2025-09-29T11:53:02.763Z",
          "formattedTime": "14:53:02",
          "time": "2025-09-29T11:53:02.763Z",
          "isManual": false
        },
        {
          "id": "1759146790756",
          "content": "234093",
          "timestamp": "2025-09-29T11:53:10.721Z",
          "formattedTime": "14:53:10",
          "time": "2025-09-29T11:53:10.721Z",
          "isManual": false
        },
        {
          "id": "1759146812370",
          "content": "234153",
          "timestamp": "2025-09-29T11:53:32.364Z",
          "formattedTime": "14:53:32",
          "time": "2025-09-29T11:53:32.364Z",
          "isManual": false
        },
        {
          "id": "1759146815926",
          "content": "234154",
          "timestamp": "2025-09-29T11:53:35.918Z",
          "formattedTime": "14:53:35",
          "time": "2025-09-29T11:53:35.918Z",
          "isManual": false
        }
      ],
      "inProgress": false,
      "isScanner": true,
      "sessionType": "scanner",
      "recoveryStatus": "closed_normally",
      "isChecklist": false,
      "backedUp": true,
      "user_email": "a4444b6514c91a6b1addfb4e79abf20b5f0433abc3dab51a28bd5736f4ec72c4",
      "user_id": "a4444b6514c91a6b1addfb4e79abf20b5f0433abc3dab51a28bd5736f4ec72c4_1763552756943",
      "created_by": "a4444b6514c91a6b1addfb4e79abf20b5f0433abc3dab51a28bd5736f4ec72c4",
      "created_at": "2025-11-19T11:45:56.943Z",
      "updated_at": "2025-11-19T11:45:56.943Z"
    },
    {
      "id": "scanner1759211113544",
      "location": "Physiology",
      "year": 3,
      "batch": "2025/2026",
      "dateTime": "2025-09-30T05:45:13.544Z",
      "formattedDateTime": "30/09/2025 08:45:13",
      "scans": [
        {
          "id": "1759211115365",
          "content": "234882",
          "timestamp": "2025-09-30T05:45:15.360Z",
          "formattedTime": "08:45:15",
          "time": "2025-09-30T05:45:15.360Z",
          "isManual": false
        }
      ],
      "inProgress": false,
      "isScanner": true,
      "sessionType": "scanner",
      "recoveryStatus": "closed_normally",
      "isChecklist": false,
      "backedUp": true,
      "user_email": "a4444b6514c91a6b1addfb4e79abf20b5f0433abc3dab51a28bd5736f4ec72c4",
      "user_id": "a4444b6514c91a6b1addfb4e79abf20b5f0433abc3dab51a28bd5736f4ec72c4_1763552756943",
      "created_by": "a4444b6514c91a6b1addfb4e79abf20b5f0433abc3dab51a28bd5736f4ec72c4",
      "created_at": "2025-11-19T11:45:56.943Z",
      "updated_at": "2025-11-19T11:45:56.943Z"
    },
    {
      "id": "scanner1759211689684",
      "location": "Physiology",
      "year": 3,
      "batch": "2025/2026",
      "dateTime": "2025-09-30T05:54:49.684Z",
      "formattedDateTime": "30/09/2025 08:54:49",
      "scans": [
        {
          "id": "1759211699189",
          "content": "234694",
          "timestamp": "2025-09-30T05:54:59.183Z",
          "formattedTime": "08:54:59",
          "time": "2025-09-30T05:54:59.183Z",
          "isManual": true
        },
        {
          "id": "1759211707827",
          "content": "234691",
          "timestamp": "2025-09-30T05:55:07.821Z",
          "formattedTime": "08:55:07",
          "time": "2025-09-30T05:55:07.821Z",
          "isManual": true
        },
        {
          "id": "1759211718535",
          "content": "234692",
          "timestamp": "2025-09-30T05:55:18.528Z",
          "formattedTime": "08:55:18",
          "time": "2025-09-30T05:55:18.528Z",
          "isManual": true
        },
        {
          "id": "1759211725454",
          "content": "234882",
          "timestamp": "2025-09-30T05:55:25.448Z",
          "formattedTime": "08:55:25",
          "time": "2025-09-30T05:55:25.448Z",
          "isManual": true
        }
      ],
      "inProgress": true,
      "isScanner": true,
      "sessionType": "scanner",
      "recoveryStatus": "in_progress",
      "isChecklist": false,
      "backedUp": true,
      "user_email": "a4444b6514c91a6b1addfb4e79abf20b5f0433abc3dab51a28bd5736f4ec72c4",
      "user_id": "a4444b6514c91a6b1addfb4e79abf20b5f0433abc3dab51a28bd5736f4ec72c4_1763552756943",
      "created_by": "a4444b6514c91a6b1addfb4e79abf20b5f0433abc3dab51a28bd5736f4ec72c4",
      "created_at": "2025-11-19T11:45:56.943Z",
      "updated_at": "2025-11-19T11:45:56.943Z"
    },
    {
      "id": "scanner1759212046741",
      "location": "Physiology",
      "year": 3,
      "batch": "2025/2026",
      "dateTime": "2025-09-30T06:00:46.741Z",
      "formattedDateTime": "30/09/2025 09:00:46",
      "scans": [
        {
          "id": "1759212090303",
          "content": "234691",
          "timestamp": "2025-09-30T06:01:30.295Z",
          "formattedTime": "09:01:30",
          "time": "2025-09-30T06:01:30.295Z",
          "isManual": true
        }
      ],
      "inProgress": true,
      "isScanner": true,
      "sessionType": "scanner",
      "recoveryStatus": "in_progress",
      "isChecklist": false,
      "backedUp": true,
      "user_email": "a4444b6514c91a6b1addfb4e79abf20b5f0433abc3dab51a28bd5736f4ec72c4",
      "user_id": "a4444b6514c91a6b1addfb4e79abf20b5f0433abc3dab51a28bd5736f4ec72c4_1763552756943",
      "created_by": "a4444b6514c91a6b1addfb4e79abf20b5f0433abc3dab51a28bd5736f4ec72c4",
      "created_at": "2025-11-19T11:45:56.943Z",
      "updated_at": "2025-11-19T11:45:56.943Z"
    },
    {
      "id": "scanner1759214427010",
      "location": "Physiology",
      "year": 3,
      "batch": "2025/2026",
      "dateTime": "2025-09-30T06:40:27.010Z",
      "formattedDateTime": "30/09/2025 09:40:27",
      "scans": [
        {
          "id": "1759214432664",
          "content": "234534",
          "timestamp": "2025-09-30T06:40:32.651Z",
          "formattedTime": "09:40:32",
          "time": "2025-09-30T06:40:32.651Z",
          "isManual": false
        },
        {
          "id": "1759214443192",
          "content": "234555",
          "timestamp": "2025-09-30T06:40:43.188Z",
          "formattedTime": "09:40:43",
          "time": "2025-09-30T06:40:43.188Z",
          "isManual": false
        },
        {
          "id": "1759214453308",
          "content": "234349",
          "timestamp": "2025-09-30T06:40:53.295Z",
          "formattedTime": "09:40:53",
          "time": "2025-09-30T06:40:53.295Z",
          "isManual": false
        },
        {
          "id": "1759214467047",
          "content": "234597",
          "timestamp": "2025-09-30T06:41:07.039Z",
          "formattedTime": "09:41:07",
          "time": "2025-09-30T06:41:07.039Z",
          "isManual": false
        },
        {
          "id": "1759214481703",
          "content": "234589",
          "timestamp": "2025-09-30T06:41:21.697Z",
          "formattedTime": "09:41:21",
          "time": "2025-09-30T06:41:21.697Z",
          "isManual": false
        },
        {
          "id": "1759214490925",
          "content": "234584",
          "timestamp": "2025-09-30T06:41:30.919Z",
          "formattedTime": "09:41:30",
          "time": "2025-09-30T06:41:30.919Z",
          "isManual": false
        },
        {
          "id": "1759214496720",
          "content": "234530",
          "timestamp": "2025-09-30T06:41:36.706Z",
          "formattedTime": "09:41:36",
          "time": "2025-09-30T06:41:36.706Z",
          "isManual": false
        },
        {
          "id": "1759214506385",
          "content": "234545",
          "timestamp": "2025-09-30T06:41:46.378Z",
          "formattedTime": "09:41:46",
          "time": "2025-09-30T06:41:46.378Z",
          "isManual": false
        },
        {
          "id": "1759214539572",
          "content": "234607",
          "timestamp": "2025-09-30T06:42:19.566Z",
          "formattedTime": "09:42:19",
          "time": "2025-09-30T06:42:19.566Z",
          "isManual": true
        },
        {
          "id": "1759214552296",
          "content": "234508",
          "timestamp": "2025-09-30T06:42:32.290Z",
          "formattedTime": "09:42:32",
          "time": "2025-09-30T06:42:32.290Z",
          "isManual": true
        },
        {
          "id": "1759214561873",
          "content": "234523",
          "timestamp": "2025-09-30T06:42:41.864Z",
          "formattedTime": "09:42:41",
          "time": "2025-09-30T06:42:41.864Z",
          "isManual": false
        },
        {
          "id": "1759214570088",
          "content": "234579",
          "timestamp": "2025-09-30T06:42:50.084Z",
          "formattedTime": "09:42:50",
          "time": "2025-09-30T06:42:50.084Z",
          "isManual": false
        }
      ],
      "inProgress": false,
      "isScanner": true,
      "sessionType": "scanner",
      "recoveryStatus": "closed_normally",
      "isChecklist": false,
      "backedUp": true,
      "user_email": "a4444b6514c91a6b1addfb4e79abf20b5f0433abc3dab51a28bd5736f4ec72c4",
      "user_id": "a4444b6514c91a6b1addfb4e79abf20b5f0433abc3dab51a28bd5736f4ec72c4_1763552756943",
      "created_by": "a4444b6514c91a6b1addfb4e79abf20b5f0433abc3dab51a28bd5736f4ec72c4",
      "created_at": "2025-11-19T11:45:56.943Z",
      "updated_at": "2025-11-19T11:45:56.943Z"
    },
    {
      "id": "scanner1759214680211",
      "location": "Physiology",
      "year": 3,
      "batch": "2025/2026",
      "dateTime": "2025-09-30T06:44:40.211Z",
      "formattedDateTime": "30/09/2025 09:44:40",
      "scans": [
        {
          "id": "1759214692484",
          "content": "234510",
          "timestamp": "2025-09-30T06:44:52.478Z",
          "formattedTime": "09:44:52",
          "time": "2025-09-30T06:44:52.478Z",
          "isManual": true
        },
        {
          "id": "1759214714297",
          "content": "234585",
          "timestamp": "2025-09-30T06:45:14.291Z",
          "formattedTime": "09:45:14",
          "time": "2025-09-30T06:45:14.291Z",
          "isManual": true
        }
      ],
      "inProgress": true,
      "isScanner": true,
      "sessionType": "scanner",
      "recoveryStatus": "in_progress",
      "isChecklist": false,
      "backedUp": true,
      "user_email": "a4444b6514c91a6b1addfb4e79abf20b5f0433abc3dab51a28bd5736f4ec72c4",
      "user_id": "a4444b6514c91a6b1addfb4e79abf20b5f0433abc3dab51a28bd5736f4ec72c4_1763552756943",
      "created_by": "a4444b6514c91a6b1addfb4e79abf20b5f0433abc3dab51a28bd5736f4ec72c4",
      "created_at": "2025-11-19T11:45:56.943Z",
      "updated_at": "2025-11-19T11:45:56.943Z"
    },
    {
      "id": "scanner1759214741933",
      "location": "Physiology",
      "year": 3,
      "batch": "2025/2026",
      "dateTime": "2025-09-30T06:45:41.933Z",
      "formattedDateTime": "30/09/2025 09:45:41",
      "scans": [
        {
          "id": "1759214747648",
          "content": "234408",
          "timestamp": "2025-09-30T06:45:47.643Z",
          "formattedTime": "09:45:47",
          "time": "2025-09-30T06:45:47.643Z",
          "isManual": true
        },
        {
          "id": "1759214766438",
          "content": "234485",
          "timestamp": "2025-09-30T06:46:06.432Z",
          "formattedTime": "09:46:06",
          "time": "2025-09-30T06:46:06.432Z",
          "isManual": false
        },
        {
          "id": "1759214808181",
          "content": "234518",
          "timestamp": "2025-09-30T06:46:48.175Z",
          "formattedTime": "09:46:48",
          "time": "2025-09-30T06:46:48.175Z",
          "isManual": false
        },
        {
          "id": "1759214853441",
          "content": "234395",
          "timestamp": "2025-09-30T06:47:33.435Z",
          "formattedTime": "09:47:33",
          "time": "2025-09-30T06:47:33.435Z",
          "isManual": false
        }
      ],
      "inProgress": false,
      "isScanner": true,
      "sessionType": "scanner",
      "recoveryStatus": "closed_normally",
      "isChecklist": false,
      "backedUp": true,
      "user_email": "a4444b6514c91a6b1addfb4e79abf20b5f0433abc3dab51a28bd5736f4ec72c4",
      "user_id": "a4444b6514c91a6b1addfb4e79abf20b5f0433abc3dab51a28bd5736f4ec72c4_1763552756943",
      "created_by": "a4444b6514c91a6b1addfb4e79abf20b5f0433abc3dab51a28bd5736f4ec72c4",
      "created_at": "2025-11-19T11:45:56.943Z",
      "updated_at": "2025-11-19T11:45:56.943Z"
    },
    {
      "id": "scanner1759299498330",
      "location": "Physiology",
      "year": 2,
      "batch": "2025/2026",
      "dateTime": "2025-10-01T06:18:18.330Z",
      "formattedDateTime": "01/10/2025 09:18:18",
      "scans": [
        {
          "id": "1759299507141",
          "content": "244520",
          "timestamp": "2025-10-01T06:18:27.137Z",
          "formattedTime": "09:18:27",
          "time": "2025-10-01T06:18:27.137Z",
          "isManual": false
        },
        {
          "id": "1759299509261",
          "content": "244474",
          "timestamp": "2025-10-01T06:18:29.255Z",
          "formattedTime": "09:18:29",
          "time": "2025-10-01T06:18:29.255Z",
          "isManual": false
        },
        {
          "id": "1759299510452",
          "content": "244549",
          "timestamp": "2025-10-01T06:18:30.439Z",
          "formattedTime": "09:18:30",
          "time": "2025-10-01T06:18:30.439Z",
          "isManual": false
        },
        {
          "id": "1759299511883",
          "content": "244452",
          "timestamp": "2025-10-01T06:18:31.873Z",
          "formattedTime": "09:18:31",
          "time": "2025-10-01T06:18:31.873Z",
          "isManual": false
        },
        {
          "id": "1759299512949",
          "content": "244482",
          "timestamp": "2025-10-01T06:18:32.940Z",
          "formattedTime": "09:18:32",
          "time": "2025-10-01T06:18:32.940Z",
          "isManual": false
        },
        {
          "id": "1759299518118",
          "content": "234769",
          "timestamp": "2025-10-01T06:18:38.111Z",
          "formattedTime": "09:18:38",
          "time": "2025-10-01T06:18:38.111Z",
          "isManual": false
        },
        {
          "id": "1759299523273",
          "content": "234779",
          "timestamp": "2025-10-01T06:18:43.250Z",
          "formattedTime": "09:18:43",
          "time": "2025-10-01T06:18:43.250Z",
          "isManual": false
        },
        {
          "id": "1759299528265",
          "content": "244576",
          "timestamp": "2025-10-01T06:18:48.239Z",
          "formattedTime": "09:18:48",
          "time": "2025-10-01T06:18:48.239Z",
          "isManual": false
        },
        {
          "id": "1759299529960",
          "content": "244453",
          "timestamp": "2025-10-01T06:18:49.936Z",
          "formattedTime": "09:18:49",
          "time": "2025-10-01T06:18:49.936Z",
          "isManual": false
        },
        {
          "id": "1759299531622",
          "content": "234950",
          "timestamp": "2025-10-01T06:18:51.588Z",
          "formattedTime": "09:18:51",
          "time": "2025-10-01T06:18:51.588Z",
          "isManual": false
        },
        {
          "id": "1759299533180",
          "content": "244353",
          "timestamp": "2025-10-01T06:18:53.170Z",
          "formattedTime": "09:18:53",
          "time": "2025-10-01T06:18:53.170Z",
          "isManual": false
        },
        {
          "id": "1759299535166",
          "content": "244434",
          "timestamp": "2025-10-01T06:18:55.155Z",
          "formattedTime": "09:18:55",
          "time": "2025-10-01T06:18:55.155Z",
          "isManual": false
        },
        {
          "id": "1759299535881",
          "content": "244542",
          "timestamp": "2025-10-01T06:18:55.871Z",
          "formattedTime": "09:18:55",
          "time": "2025-10-01T06:18:55.871Z",
          "isManual": false
        },
        {
          "id": "1759299539768",
          "content": "234695",
          "timestamp": "2025-10-01T06:18:59.757Z",
          "formattedTime": "09:18:59",
          "time": "2025-10-01T06:18:59.757Z",
          "isManual": false
        },
        {
          "id": "1759299544179",
          "content": "234780",
          "timestamp": "2025-10-01T06:19:04.160Z",
          "formattedTime": "09:19:04",
          "time": "2025-10-01T06:19:04.160Z",
          "isManual": false
        }
      ],
      "inProgress": true,
      "isScanner": true,
      "sessionType": "scanner",
      "recoveryStatus": "in_progress",
      "isChecklist": false,
      "backedUp": true,
      "user_email": "a4444b6514c91a6b1addfb4e79abf20b5f0433abc3dab51a28bd5736f4ec72c4",
      "user_id": "a4444b6514c91a6b1addfb4e79abf20b5f0433abc3dab51a28bd5736f4ec72c4_1763552756943",
      "created_by": "a4444b6514c91a6b1addfb4e79abf20b5f0433abc3dab51a28bd5736f4ec72c4",
      "created_at": "2025-11-19T11:45:56.943Z",
      "updated_at": "2025-11-19T11:45:56.943Z"
    },
    {
      "id": "scanner1759300329909",
      "location": "Physiology",
      "year": 2,
      "batch": "2025/2026",
      "dateTime": "2025-10-01T06:32:09.909Z",
      "formattedDateTime": "01/10/2025 09:32:09",
      "scans": [
        {
          "id": "1759300332325",
          "content": "244224",
          "timestamp": "2025-10-01T06:32:12.314Z",
          "formattedTime": "09:32:12",
          "time": "2025-10-01T06:32:12.314Z",
          "isManual": false
        },
        {
          "id": "1759300365247",
          "content": "244538",
          "timestamp": "2025-10-01T06:32:45.241Z",
          "formattedTime": "09:32:45",
          "time": "2025-10-01T06:32:45.241Z",
          "isManual": true
        },
        {
          "id": "1759300371468",
          "content": "244559",
          "timestamp": "2025-10-01T06:32:51.461Z",
          "formattedTime": "09:32:51",
          "time": "2025-10-01T06:32:51.461Z",
          "isManual": true
        },
        {
          "id": "1759300390416",
          "content": "244223",
          "timestamp": "2025-10-01T06:33:10.407Z",
          "formattedTime": "09:33:10",
          "time": "2025-10-01T06:33:10.407Z",
          "isManual": false
        },
        {
          "id": "1759300474605",
          "content": "234502",
          "timestamp": "2025-10-01T06:34:34.598Z",
          "formattedTime": "09:34:34",
          "time": "2025-10-01T06:34:34.598Z",
          "isManual": true
        },
        {
          "id": "1759300664530",
          "content": "244285",
          "timestamp": "2025-10-01T06:37:44.525Z",
          "formattedTime": "09:37:44",
          "time": "2025-10-01T06:37:44.525Z",
          "isManual": false
        },
        {
          "id": "1759300714525",
          "content": "244298",
          "timestamp": "2025-10-01T06:38:34.513Z",
          "formattedTime": "09:38:34",
          "time": "2025-10-01T06:38:34.513Z",
          "isManual": false
        },
        {
          "id": "1759300860298",
          "content": "244325",
          "timestamp": "2025-10-01T06:41:00.289Z",
          "formattedTime": "09:41:00",
          "time": "2025-10-01T06:41:00.289Z",
          "isManual": false
        },
        {
          "id": "1759300862229",
          "content": "244322",
          "timestamp": "2025-10-01T06:41:02.220Z",
          "formattedTime": "09:41:02",
          "time": "2025-10-01T06:41:02.220Z",
          "isManual": false
        },
        {
          "id": "1759300914273",
          "content": "244327",
          "timestamp": "2025-10-01T06:41:54.265Z",
          "formattedTime": "09:41:54",
          "time": "2025-10-01T06:41:54.265Z",
          "isManual": false
        },
        {
          "id": "1759300929081",
          "content": "244253",
          "timestamp": "2025-10-01T06:42:09.077Z",
          "formattedTime": "09:42:09",
          "time": "2025-10-01T06:42:09.077Z",
          "isManual": false
        },
        {
          "id": "1759301036253",
          "content": "244226",
          "timestamp": "2025-10-01T06:43:56.246Z",
          "formattedTime": "09:43:56",
          "time": "2025-10-01T06:43:56.246Z",
          "isManual": false
        },
        {
          "id": "1759301054252",
          "content": "244318",
          "timestamp": "2025-10-01T06:44:14.229Z",
          "formattedTime": "09:44:14",
          "time": "2025-10-01T06:44:14.229Z",
          "isManual": false
        },
        {
          "id": "1759301063142",
          "content": "244321",
          "timestamp": "2025-10-01T06:44:23.136Z",
          "formattedTime": "09:44:23",
          "time": "2025-10-01T06:44:23.136Z",
          "isManual": false
        }
      ],
      "inProgress": true,
      "isScanner": true,
      "sessionType": "scanner",
      "recoveryStatus": "in_progress",
      "isChecklist": false,
      "backedUp": true,
      "user_email": "a4444b6514c91a6b1addfb4e79abf20b5f0433abc3dab51a28bd5736f4ec72c4",
      "user_id": "a4444b6514c91a6b1addfb4e79abf20b5f0433abc3dab51a28bd5736f4ec72c4_1763552756943",
      "created_by": "a4444b6514c91a6b1addfb4e79abf20b5f0433abc3dab51a28bd5736f4ec72c4",
      "created_at": "2025-11-19T11:45:56.943Z",
      "updated_at": "2025-11-19T11:45:56.943Z"
    },
    {
      "id": "scanner1759307057359",
      "location": "Physiology",
      "year": 2,
      "batch": "2025/2026",
      "dateTime": "2025-10-01T08:24:17.359Z",
      "formattedDateTime": "01/10/2025 11:24:17",
      "scans": [
        {
          "id": "1759307063306",
          "content": "244350",
          "timestamp": "2025-10-01T08:24:23.297Z",
          "formattedTime": "11:24:23",
          "time": "2025-10-01T08:24:23.297Z",
          "isManual": false
        },
        {
          "id": "1759307065845",
          "content": "244358",
          "timestamp": "2025-10-01T08:24:25.832Z",
          "formattedTime": "11:24:25",
          "time": "2025-10-01T08:24:25.832Z",
          "isManual": false
        },
        {
          "id": "1759307074695",
          "content": "244369",
          "timestamp": "2025-10-01T08:24:34.687Z",
          "formattedTime": "11:24:34",
          "time": "2025-10-01T08:24:34.687Z",
          "isManual": false
        },
        {
          "id": "1759307086799",
          "content": "244360",
          "timestamp": "2025-10-01T08:24:46.780Z",
          "formattedTime": "11:24:46",
          "time": "2025-10-01T08:24:46.780Z",
          "isManual": false
        },
        {
          "id": "1759307087890",
          "content": "244349",
          "timestamp": "2025-10-01T08:24:47.880Z",
          "formattedTime": "11:24:47",
          "time": "2025-10-01T08:24:47.880Z",
          "isManual": false
        },
        {
          "id": "1759307089273",
          "content": "244348",
          "timestamp": "2025-10-01T08:24:49.264Z",
          "formattedTime": "11:24:49",
          "time": "2025-10-01T08:24:49.264Z",
          "isManual": false
        },
        {
          "id": "1759307089667",
          "content": "244372",
          "timestamp": "2025-10-01T08:24:49.663Z",
          "formattedTime": "11:24:49",
          "time": "2025-10-01T08:24:49.663Z",
          "isManual": false
        },
        {
          "id": "1759307094076",
          "content": "244356",
          "timestamp": "2025-10-01T08:24:54.066Z",
          "formattedTime": "11:24:54",
          "time": "2025-10-01T08:24:54.066Z",
          "isManual": false
        },
        {
          "id": "1759307095589",
          "content": "244345",
          "timestamp": "2025-10-01T08:24:55.583Z",
          "formattedTime": "11:24:55",
          "time": "2025-10-01T08:24:55.583Z",
          "isManual": false
        },
        {
          "id": "1759307097411",
          "content": "244340",
          "timestamp": "2025-10-01T08:24:57.402Z",
          "formattedTime": "11:24:57",
          "time": "2025-10-01T08:24:57.402Z",
          "isManual": false
        },
        {
          "id": "1759307099114",
          "content": "244354",
          "timestamp": "2025-10-01T08:24:59.104Z",
          "formattedTime": "11:24:59",
          "time": "2025-10-01T08:24:59.104Z",
          "isManual": false
        },
        {
          "id": "1759307100316",
          "content": "244343",
          "timestamp": "2025-10-01T08:25:00.305Z",
          "formattedTime": "11:25:00",
          "time": "2025-10-01T08:25:00.305Z",
          "isManual": false
        },
        {
          "id": "1759307101748",
          "content": "244367",
          "timestamp": "2025-10-01T08:25:01.738Z",
          "formattedTime": "11:25:01",
          "time": "2025-10-01T08:25:01.738Z",
          "isManual": false
        },
        {
          "id": "1759307103182",
          "content": "244346",
          "timestamp": "2025-10-01T08:25:03.172Z",
          "formattedTime": "11:25:03",
          "time": "2025-10-01T08:25:03.172Z",
          "isManual": false
        },
        {
          "id": "1759307104381",
          "content": "244366",
          "timestamp": "2025-10-01T08:25:04.372Z",
          "formattedTime": "11:25:04",
          "time": "2025-10-01T08:25:04.372Z",
          "isManual": false
        },
        {
          "id": "1759307106446",
          "content": "244364",
          "timestamp": "2025-10-01T08:25:06.426Z",
          "formattedTime": "11:25:06",
          "time": "2025-10-01T08:25:06.426Z",
          "isManual": false
        },
        {
          "id": "1759307108102",
          "content": "244373",
          "timestamp": "2025-10-01T08:25:08.092Z",
          "formattedTime": "11:25:08",
          "time": "2025-10-01T08:25:08.092Z",
          "isManual": false
        },
        {
          "id": "1759307109102",
          "content": "244365",
          "timestamp": "2025-10-01T08:25:09.093Z",
          "formattedTime": "11:25:09",
          "time": "2025-10-01T08:25:09.093Z",
          "isManual": false
        },
        {
          "id": "1759307126259",
          "content": "244391",
          "timestamp": "2025-10-01T08:25:26.253Z",
          "formattedTime": "11:25:26",
          "time": "2025-10-01T08:25:26.253Z",
          "isManual": true
        },
        {
          "id": "1759307135247",
          "content": "244370",
          "timestamp": "2025-10-01T08:25:35.241Z",
          "formattedTime": "11:25:35",
          "time": "2025-10-01T08:25:35.241Z",
          "isManual": true
        },
        {
          "id": "1759307143786",
          "content": "244387",
          "timestamp": "2025-10-01T08:25:43.780Z",
          "formattedTime": "11:25:43",
          "time": "2025-10-01T08:25:43.780Z",
          "isManual": true
        }
      ],
      "inProgress": false,
      "isScanner": true,
      "sessionType": "scanner",
      "recoveryStatus": "closed_normally",
      "isChecklist": false,
      "backedUp": true,
      "user_email": "a4444b6514c91a6b1addfb4e79abf20b5f0433abc3dab51a28bd5736f4ec72c4",
      "user_id": "a4444b6514c91a6b1addfb4e79abf20b5f0433abc3dab51a28bd5736f4ec72c4_1763552756943",
      "created_by": "a4444b6514c91a6b1addfb4e79abf20b5f0433abc3dab51a28bd5736f4ec72c4",
      "created_at": "2025-11-19T11:45:56.943Z",
      "updated_at": "2025-11-19T11:45:56.943Z"
    },
    {
      "id": "scanner1759311538392",
      "location": "Physiology",
      "year": 3,
      "batch": "2025/2026",
      "dateTime": "2025-10-01T09:38:58.392Z",
      "formattedDateTime": "01/10/2025 12:38:58",
      "scans": [
        {
          "id": "1759311539758",
          "content": "234840",
          "timestamp": "2025-10-01T09:38:59.754Z",
          "formattedTime": "12:38:59",
          "time": "2025-10-01T09:38:59.754Z",
          "isManual": false
        },
        {
          "id": "1759311549530",
          "content": "234819",
          "timestamp": "2025-10-01T09:39:09.518Z",
          "formattedTime": "12:39:09",
          "time": "2025-10-01T09:39:09.518Z",
          "isManual": false
        },
        {
          "id": "1759311551145",
          "content": "234814",
          "timestamp": "2025-10-01T09:39:11.138Z",
          "formattedTime": "12:39:11",
          "time": "2025-10-01T09:39:11.138Z",
          "isManual": false
        },
        {
          "id": "1759311553737",
          "content": "234820",
          "timestamp": "2025-10-01T09:39:13.720Z",
          "formattedTime": "12:39:13",
          "time": "2025-10-01T09:39:13.720Z",
          "isManual": false
        },
        {
          "id": "1759311558938",
          "content": "234833",
          "timestamp": "2025-10-01T09:39:18.909Z",
          "formattedTime": "12:39:18",
          "time": "2025-10-01T09:39:18.909Z",
          "isManual": false
        },
        {
          "id": "1759311583172",
          "content": "234823",
          "timestamp": "2025-10-01T09:39:43.140Z",
          "formattedTime": "12:39:43",
          "time": "2025-10-01T09:39:43.140Z",
          "isManual": false
        },
        {
          "id": "1759311585701",
          "content": "234853",
          "timestamp": "2025-10-01T09:39:45.690Z",
          "formattedTime": "12:39:45",
          "time": "2025-10-01T09:39:45.690Z",
          "isManual": false
        },
        {
          "id": "1759311587686",
          "content": "234815",
          "timestamp": "2025-10-01T09:39:47.675Z",
          "formattedTime": "12:39:47",
          "time": "2025-10-01T09:39:47.675Z",
          "isManual": false
        },
        {
          "id": "1759311589786",
          "content": "234831",
          "timestamp": "2025-10-01T09:39:49.776Z",
          "formattedTime": "12:39:49",
          "time": "2025-10-01T09:39:49.776Z",
          "isManual": false
        },
        {
          "id": "1759311606396",
          "content": "234851",
          "timestamp": "2025-10-01T09:40:06.388Z",
          "formattedTime": "12:40:06",
          "time": "2025-10-01T09:40:06.388Z",
          "isManual": false
        },
        {
          "id": "1759311608362",
          "content": "234834",
          "timestamp": "2025-10-01T09:40:08.325Z",
          "formattedTime": "12:40:08",
          "time": "2025-10-01T09:40:08.325Z",
          "isManual": false
        },
        {
          "id": "1759311610426",
          "content": "234846",
          "timestamp": "2025-10-01T09:40:10.393Z",
          "formattedTime": "12:40:10",
          "time": "2025-10-01T09:40:10.393Z",
          "isManual": false
        }
      ],
      "inProgress": true,
      "isScanner": true,
      "sessionType": "scanner",
      "recoveryStatus": "in_progress",
      "isChecklist": false,
      "backedUp": true,
      "user_email": "a4444b6514c91a6b1addfb4e79abf20b5f0433abc3dab51a28bd5736f4ec72c4",
      "user_id": "a4444b6514c91a6b1addfb4e79abf20b5f0433abc3dab51a28bd5736f4ec72c4_1763552756943",
      "created_by": "a4444b6514c91a6b1addfb4e79abf20b5f0433abc3dab51a28bd5736f4ec72c4",
      "created_at": "2025-11-19T11:45:56.943Z",
      "updated_at": "2025-11-19T11:45:56.943Z"
    },
    {
      "id": "scanner1759311648755",
      "location": "Physiology",
      "year": 3,
      "batch": "2025/2026",
      "dateTime": "2025-10-01T09:40:48.755Z",
      "formattedDateTime": "01/10/2025 12:40:48",
      "scans": [
        {
          "id": "1759311658342",
          "content": "234845",
          "timestamp": "2025-10-01T09:40:58.336Z",
          "formattedTime": "12:40:58",
          "time": "2025-10-01T09:40:58.336Z",
          "isManual": true
        },
        {
          "id": "1759311662946",
          "content": "234847",
          "timestamp": "2025-10-01T09:41:02.939Z",
          "formattedTime": "12:41:02",
          "time": "2025-10-01T09:41:02.939Z",
          "isManual": true
        },
        {
          "id": "1759311680539",
          "content": "234827",
          "timestamp": "2025-10-01T09:41:20.533Z",
          "formattedTime": "12:41:20",
          "time": "2025-10-01T09:41:20.533Z",
          "isManual": true
        },
        {
          "id": "1759311688394",
          "content": "234806",
          "timestamp": "2025-10-01T09:41:28.388Z",
          "formattedTime": "12:41:28",
          "time": "2025-10-01T09:41:28.388Z",
          "isManual": true
        },
        {
          "id": "1759311771282",
          "content": "234809",
          "timestamp": "2025-10-01T09:42:51.275Z",
          "formattedTime": "12:42:51",
          "time": "2025-10-01T09:42:51.275Z",
          "isManual": true
        }
      ],
      "inProgress": false,
      "isScanner": true,
      "sessionType": "scanner",
      "recoveryStatus": "closed_normally",
      "isChecklist": false,
      "backedUp": true,
      "user_email": "a4444b6514c91a6b1addfb4e79abf20b5f0433abc3dab51a28bd5736f4ec72c4",
      "user_id": "a4444b6514c91a6b1addfb4e79abf20b5f0433abc3dab51a28bd5736f4ec72c4_1763552756943",
      "created_by": "a4444b6514c91a6b1addfb4e79abf20b5f0433abc3dab51a28bd5736f4ec72c4",
      "created_at": "2025-11-19T11:45:56.943Z",
      "updated_at": "2025-11-19T11:45:56.943Z"
    },
    {
      "id": "scanner1759645263488",
      "location": "Physiology",
      "year": 2,
      "batch": "2025/2026",
      "dateTime": "2025-10-05T06:21:03.488Z",
      "formattedDateTime": "05/10/2025 09:21:03",
      "scans": [
        {
          "id": "1759645264716",
          "content": "244063",
          "timestamp": "2025-10-05T06:21:04.711Z",
          "formattedTime": "09:21:04",
          "time": "2025-10-05T06:21:04.711Z",
          "isManual": false
        },
        {
          "id": "1759645269032",
          "content": "244055",
          "timestamp": "2025-10-05T06:21:09.006Z",
          "formattedTime": "09:21:09",
          "time": "2025-10-05T06:21:09.006Z",
          "isManual": false
        },
        {
          "id": "1759645414487",
          "content": "244093",
          "timestamp": "2025-10-05T06:23:34.481Z",
          "formattedTime": "09:23:34",
          "time": "2025-10-05T06:23:34.481Z",
          "isManual": false
        },
        {
          "id": "1759645416909",
          "content": "244066",
          "timestamp": "2025-10-05T06:23:36.902Z",
          "formattedTime": "09:23:36",
          "time": "2025-10-05T06:23:36.902Z",
          "isManual": false
        },
        {
          "id": "1759645544870",
          "content": "244091",
          "timestamp": "2025-10-05T06:25:44.859Z",
          "formattedTime": "09:25:44",
          "time": "2025-10-05T06:25:44.859Z",
          "isManual": false
        },
        {
          "id": "1759645547420",
          "content": "244067",
          "timestamp": "2025-10-05T06:25:47.411Z",
          "formattedTime": "09:25:47",
          "time": "2025-10-05T06:25:47.411Z",
          "isManual": false
        },
        {
          "id": "1759645549342",
          "content": "244058",
          "timestamp": "2025-10-05T06:25:49.331Z",
          "formattedTime": "09:25:49",
          "time": "2025-10-05T06:25:49.331Z",
          "isManual": false
        },
        {
          "id": "1759645550301",
          "content": "244065",
          "timestamp": "2025-10-05T06:25:50.296Z",
          "formattedTime": "09:25:50",
          "time": "2025-10-05T06:25:50.296Z",
          "isManual": false
        },
        {
          "id": "1759645555160",
          "content": "244059",
          "timestamp": "2025-10-05T06:25:55.149Z",
          "formattedTime": "09:25:55",
          "time": "2025-10-05T06:25:55.149Z",
          "isManual": false
        },
        {
          "id": "1759645871136",
          "content": "244087",
          "timestamp": "2025-10-05T06:31:11.127Z",
          "formattedTime": "09:31:11",
          "time": "2025-10-05T06:31:11.127Z",
          "isManual": false
        },
        {
          "id": "1759645875025",
          "content": "244096",
          "timestamp": "2025-10-05T06:31:15.014Z",
          "formattedTime": "09:31:15",
          "time": "2025-10-05T06:31:15.014Z",
          "isManual": false
        },
        {
          "id": "1759645877219",
          "content": "244080",
          "timestamp": "2025-10-05T06:31:17.214Z",
          "formattedTime": "09:31:17",
          "time": "2025-10-05T06:31:17.214Z",
          "isManual": false
        },
        {
          "id": "1759645878688",
          "content": "244092",
          "timestamp": "2025-10-05T06:31:18.682Z",
          "formattedTime": "09:31:18",
          "time": "2025-10-05T06:31:18.682Z",
          "isManual": false
        },
        {
          "id": "1759645880759",
          "content": "244072",
          "timestamp": "2025-10-05T06:31:20.749Z",
          "formattedTime": "09:31:20",
          "time": "2025-10-05T06:31:20.749Z",
          "isManual": false
        },
        {
          "id": "1759645881675",
          "content": "244056",
          "timestamp": "2025-10-05T06:31:21.667Z",
          "formattedTime": "09:31:21",
          "time": "2025-10-05T06:31:21.667Z",
          "isManual": false
        },
        {
          "id": "1759645882320",
          "content": "244098",
          "timestamp": "2025-10-05T06:31:22.317Z",
          "formattedTime": "09:31:22",
          "time": "2025-10-05T06:31:22.317Z",
          "isManual": false
        },
        {
          "id": "1759645885279",
          "content": "244078",
          "timestamp": "2025-10-05T06:31:25.269Z",
          "formattedTime": "09:31:25",
          "time": "2025-10-05T06:31:25.269Z",
          "isManual": false
        },
        {
          "id": "1759645886563",
          "content": "244075",
          "timestamp": "2025-10-05T06:31:26.553Z",
          "formattedTime": "09:31:26",
          "time": "2025-10-05T06:31:26.553Z",
          "isManual": false
        },
        {
          "id": "1759645887930",
          "content": "244082",
          "timestamp": "2025-10-05T06:31:27.921Z",
          "formattedTime": "09:31:27",
          "time": "2025-10-05T06:31:27.921Z",
          "isManual": false
        },
        {
          "id": "1759645890020",
          "content": "244101",
          "timestamp": "2025-10-05T06:31:30.006Z",
          "formattedTime": "09:31:30",
          "time": "2025-10-05T06:31:30.006Z",
          "isManual": false
        },
        {
          "id": "1759645891378",
          "content": "244099",
          "timestamp": "2025-10-05T06:31:31.372Z",
          "formattedTime": "09:31:31",
          "time": "2025-10-05T06:31:31.372Z",
          "isManual": false
        },
        {
          "id": "1759645907988",
          "content": "244071",
          "timestamp": "2025-10-05T06:31:47.982Z",
          "formattedTime": "09:31:47",
          "time": "2025-10-05T06:31:47.982Z",
          "isManual": true
        },
        {
          "id": "1759645914977",
          "content": "244062",
          "timestamp": "2025-10-05T06:31:54.970Z",
          "formattedTime": "09:31:54",
          "time": "2025-10-05T06:31:54.970Z",
          "isManual": true
        }
      ],
      "inProgress": true,
      "isScanner": true,
      "sessionType": "scanner",
      "recoveryStatus": "in_progress",
      "isChecklist": false,
      "backedUp": true,
      "user_email": "a4444b6514c91a6b1addfb4e79abf20b5f0433abc3dab51a28bd5736f4ec72c4",
      "user_id": "a4444b6514c91a6b1addfb4e79abf20b5f0433abc3dab51a28bd5736f4ec72c4_1763552756943",
      "created_by": "a4444b6514c91a6b1addfb4e79abf20b5f0433abc3dab51a28bd5736f4ec72c4",
      "created_at": "2025-11-19T11:45:56.943Z",
      "updated_at": "2025-11-19T11:45:56.943Z"
    },
    {
      "id": "scanner1759746573670",
      "location": "Physiology",
      "year": 2,
      "batch": "2025/2026",
      "dateTime": "2025-10-06T10:29:33.670Z",
      "formattedDateTime": "06/10/2025 13:29:33",
      "scans": [
        {
          "id": "1759746576806",
          "content": "244663",
          "timestamp": "2025-10-06T10:29:36.800Z",
          "formattedTime": "13:29:36",
          "time": "2025-10-06T10:29:36.800Z",
          "isManual": false
        },
        {
          "id": "1759746577975",
          "content": "244698",
          "timestamp": "2025-10-06T10:29:37.966Z",
          "formattedTime": "13:29:37",
          "time": "2025-10-06T10:29:37.966Z",
          "isManual": false
        },
        {
          "id": "1759746579219",
          "content": "244735",
          "timestamp": "2025-10-06T10:29:39.215Z",
          "formattedTime": "13:29:39",
          "time": "2025-10-06T10:29:39.215Z",
          "isManual": false
        },
        {
          "id": "1759746580380",
          "content": "244607",
          "timestamp": "2025-10-06T10:29:40.368Z",
          "formattedTime": "13:29:40",
          "time": "2025-10-06T10:29:40.368Z",
          "isManual": false
        },
        {
          "id": "1759746581592",
          "content": "244584",
          "timestamp": "2025-10-06T10:29:41.585Z",
          "formattedTime": "13:29:41",
          "time": "2025-10-06T10:29:41.585Z",
          "isManual": false
        },
        {
          "id": "1759746582664",
          "content": "244712",
          "timestamp": "2025-10-06T10:29:42.653Z",
          "formattedTime": "13:29:42",
          "time": "2025-10-06T10:29:42.653Z",
          "isManual": false
        },
        {
          "id": "1759746583646",
          "content": "244741",
          "timestamp": "2025-10-06T10:29:43.636Z",
          "formattedTime": "13:29:43",
          "time": "2025-10-06T10:29:43.636Z",
          "isManual": false
        },
        {
          "id": "1759746584981",
          "content": "244734",
          "timestamp": "2025-10-06T10:29:44.971Z",
          "formattedTime": "13:29:44",
          "time": "2025-10-06T10:29:44.971Z",
          "isManual": false
        },
        {
          "id": "1759746586366",
          "content": "244585",
          "timestamp": "2025-10-06T10:29:46.355Z",
          "formattedTime": "13:29:46",
          "time": "2025-10-06T10:29:46.355Z",
          "isManual": false
        },
        {
          "id": "1759746587448",
          "content": "244653",
          "timestamp": "2025-10-06T10:29:47.439Z",
          "formattedTime": "13:29:47",
          "time": "2025-10-06T10:29:47.439Z",
          "isManual": false
        },
        {
          "id": "1759746589320",
          "content": "244758",
          "timestamp": "2025-10-06T10:29:49.308Z",
          "formattedTime": "13:29:49",
          "time": "2025-10-06T10:29:49.308Z",
          "isManual": false
        },
        {
          "id": "1759746590184",
          "content": "244608",
          "timestamp": "2025-10-06T10:29:50.174Z",
          "formattedTime": "13:29:50",
          "time": "2025-10-06T10:29:50.174Z",
          "isManual": false
        },
        {
          "id": "1759746609742",
          "content": "244715",
          "timestamp": "2025-10-06T10:30:09.736Z",
          "formattedTime": "13:30:09",
          "time": "2025-10-06T10:30:09.736Z",
          "isManual": true
        },
        {
          "id": "1759746624551",
          "content": "244757",
          "timestamp": "2025-10-06T10:30:24.544Z",
          "formattedTime": "13:30:24",
          "time": "2025-10-06T10:30:24.544Z",
          "isManual": true
        }
      ],
      "inProgress": false,
      "isScanner": true,
      "sessionType": "scanner",
      "recoveryStatus": "closed_normally",
      "isChecklist": false,
      "backedUp": true,
      "user_email": "a4444b6514c91a6b1addfb4e79abf20b5f0433abc3dab51a28bd5736f4ec72c4",
      "user_id": "a4444b6514c91a6b1addfb4e79abf20b5f0433abc3dab51a28bd5736f4ec72c4_1763552756943",
      "created_by": "a4444b6514c91a6b1addfb4e79abf20b5f0433abc3dab51a28bd5736f4ec72c4",
      "created_at": "2025-11-19T11:45:56.943Z",
      "updated_at": "2025-11-19T11:45:56.943Z"
    },
    {
      "id": "scanner1759752665445",
      "location": "Physiology",
      "year": 2,
      "batch": "2025/2026",
      "dateTime": "2025-10-06T12:11:05.445Z",
      "formattedDateTime": "06/10/2025 15:11:05",
      "scans": [
        {
          "id": "1759752667330",
          "content": "241043",
          "timestamp": "2025-10-06T12:11:07.324Z",
          "formattedTime": "15:11:07",
          "time": "2025-10-06T12:11:07.324Z",
          "isManual": false
        },
        {
          "id": "1759752668138",
          "content": "241055",
          "timestamp": "2025-10-06T12:11:08.130Z",
          "formattedTime": "15:11:08",
          "time": "2025-10-06T12:11:08.130Z",
          "isManual": false
        },
        {
          "id": "1759752669020",
          "content": "241057",
          "timestamp": "2025-10-06T12:11:09.015Z",
          "formattedTime": "15:11:09",
          "time": "2025-10-06T12:11:09.015Z",
          "isManual": false
        },
        {
          "id": "1759752669520",
          "content": "241068",
          "timestamp": "2025-10-06T12:11:09.514Z",
          "formattedTime": "15:11:09",
          "time": "2025-10-06T12:11:09.514Z",
          "isManual": false
        },
        {
          "id": "1759752671219",
          "content": "241046",
          "timestamp": "2025-10-06T12:11:11.215Z",
          "formattedTime": "15:11:11",
          "time": "2025-10-06T12:11:11.215Z",
          "isManual": false
        },
        {
          "id": "1759752673025",
          "content": "241065",
          "timestamp": "2025-10-06T12:11:13.018Z",
          "formattedTime": "15:11:13",
          "time": "2025-10-06T12:11:13.018Z",
          "isManual": false
        },
        {
          "id": "1759752675292",
          "content": "241044",
          "timestamp": "2025-10-06T12:11:15.285Z",
          "formattedTime": "15:11:15",
          "time": "2025-10-06T12:11:15.285Z",
          "isManual": false
        },
        {
          "id": "1759752676511",
          "content": "241059",
          "timestamp": "2025-10-06T12:11:16.502Z",
          "formattedTime": "15:11:16",
          "time": "2025-10-06T12:11:16.502Z",
          "isManual": false
        },
        {
          "id": "1759752677745",
          "content": "241056",
          "timestamp": "2025-10-06T12:11:17.737Z",
          "formattedTime": "15:11:17",
          "time": "2025-10-06T12:11:17.737Z",
          "isManual": false
        },
        {
          "id": "1759752684720",
          "content": "241060",
          "timestamp": "2025-10-06T12:11:24.692Z",
          "formattedTime": "15:11:24",
          "time": "2025-10-06T12:11:24.692Z",
          "isManual": false
        },
        {
          "id": "1759752685365",
          "content": "241067",
          "timestamp": "2025-10-06T12:11:25.359Z",
          "formattedTime": "15:11:25",
          "time": "2025-10-06T12:11:25.359Z",
          "isManual": false
        },
        {
          "id": "1759752686507",
          "content": "241054",
          "timestamp": "2025-10-06T12:11:26.493Z",
          "formattedTime": "15:11:26",
          "time": "2025-10-06T12:11:26.493Z",
          "isManual": false
        },
        {
          "id": "1759752692758",
          "content": "241036",
          "timestamp": "2025-10-06T12:11:32.747Z",
          "formattedTime": "15:11:32",
          "time": "2025-10-06T12:11:32.747Z",
          "isManual": false
        },
        {
          "id": "1759752693855",
          "content": "241064",
          "timestamp": "2025-10-06T12:11:33.847Z",
          "formattedTime": "15:11:33",
          "time": "2025-10-06T12:11:33.847Z",
          "isManual": false
        },
        {
          "id": "1759752694792",
          "content": "241037",
          "timestamp": "2025-10-06T12:11:34.781Z",
          "formattedTime": "15:11:34",
          "time": "2025-10-06T12:11:34.781Z",
          "isManual": false
        },
        {
          "id": "1759752695759",
          "content": "241042",
          "timestamp": "2025-10-06T12:11:35.748Z",
          "formattedTime": "15:11:35",
          "time": "2025-10-06T12:11:35.748Z",
          "isManual": false
        },
        {
          "id": "1759752696792",
          "content": "241040",
          "timestamp": "2025-10-06T12:11:36.782Z",
          "formattedTime": "15:11:36",
          "time": "2025-10-06T12:11:36.782Z",
          "isManual": false
        },
        {
          "id": "1759752697759",
          "content": "241061",
          "timestamp": "2025-10-06T12:11:37.750Z",
          "formattedTime": "15:11:37",
          "time": "2025-10-06T12:11:37.750Z",
          "isManual": false
        },
        {
          "id": "1759752698828",
          "content": "241058",
          "timestamp": "2025-10-06T12:11:38.818Z",
          "formattedTime": "15:11:38",
          "time": "2025-10-06T12:11:38.818Z",
          "isManual": false
        },
        {
          "id": "1759752699791",
          "content": "241034",
          "timestamp": "2025-10-06T12:11:39.784Z",
          "formattedTime": "15:11:39",
          "time": "2025-10-06T12:11:39.784Z",
          "isManual": false
        },
        {
          "id": "1759752700729",
          "content": "241052",
          "timestamp": "2025-10-06T12:11:40.719Z",
          "formattedTime": "15:11:40",
          "time": "2025-10-06T12:11:40.719Z",
          "isManual": false
        },
        {
          "id": "1759752701903",
          "content": "241051",
          "timestamp": "2025-10-06T12:11:41.891Z",
          "formattedTime": "15:11:41",
          "time": "2025-10-06T12:11:41.891Z",
          "isManual": false
        },
        {
          "id": "1759752702944",
          "content": "241041",
          "timestamp": "2025-10-06T12:11:42.936Z",
          "formattedTime": "15:11:42",
          "time": "2025-10-06T12:11:42.936Z",
          "isManual": false
        },
        {
          "id": "1759752715035",
          "content": "241053",
          "timestamp": "2025-10-06T12:11:55.028Z",
          "formattedTime": "15:11:55",
          "time": "2025-10-06T12:11:55.028Z",
          "isManual": true
        },
        {
          "id": "1759752722188",
          "content": "241001",
          "timestamp": "2025-10-06T12:12:02.181Z",
          "formattedTime": "15:12:02",
          "time": "2025-10-06T12:12:02.181Z",
          "isManual": true
        },
        {
          "id": "1759752729325",
          "content": "241063",
          "timestamp": "2025-10-06T12:12:09.319Z",
          "formattedTime": "15:12:09",
          "time": "2025-10-06T12:12:09.319Z",
          "isManual": true
        }
      ],
      "inProgress": false,
      "isScanner": true,
      "sessionType": "scanner",
      "recoveryStatus": "closed_normally",
      "isChecklist": false,
      "backedUp": true,
      "user_email": "a4444b6514c91a6b1addfb4e79abf20b5f0433abc3dab51a28bd5736f4ec72c4",
      "user_id": "a4444b6514c91a6b1addfb4e79abf20b5f0433abc3dab51a28bd5736f4ec72c4_1763552756943",
      "created_by": "a4444b6514c91a6b1addfb4e79abf20b5f0433abc3dab51a28bd5736f4ec72c4",
      "created_at": "2025-11-19T11:45:56.943Z",
      "updated_at": "2025-11-19T11:45:56.943Z"
    },
    {
      "id": "scanner1762240158425",
      "location": "Physiology",
      "year": 3,
      "batch": "2025/2026",
      "dateTime": "2025-11-04T07:09:18.425Z",
      "formattedDateTime": "04/11/2025 09:09:18",
      "scans": [
        {
          "id": "1762240161026",
          "content": "211762",
          "timestamp": "2025-11-04T07:09:21.020Z",
          "formattedTime": "09:09:21",
          "time": "2025-11-04T07:09:21.020Z",
          "isManual": false
        },
        {
          "id": "1762240162062",
          "content": "211661",
          "timestamp": "2025-11-04T07:09:22.053Z",
          "formattedTime": "09:09:22",
          "time": "2025-11-04T07:09:22.053Z",
          "isManual": false
        },
        {
          "id": "1762240163952",
          "content": "211722",
          "timestamp": "2025-11-04T07:09:23.939Z",
          "formattedTime": "09:09:23",
          "time": "2025-11-04T07:09:23.939Z",
          "isManual": false
        },
        {
          "id": "1762240166884",
          "content": "211647",
          "timestamp": "2025-11-04T07:09:26.873Z",
          "formattedTime": "09:09:26",
          "time": "2025-11-04T07:09:26.873Z",
          "isManual": false
        },
        {
          "id": "1762240209862",
          "content": "211910",
          "timestamp": "2025-11-04T07:10:09.856Z",
          "formattedTime": "09:10:09",
          "time": "2025-11-04T07:10:09.856Z",
          "isManual": true
        },
        {
          "id": "1762240219553",
          "content": "211673",
          "timestamp": "2025-11-04T07:10:19.546Z",
          "formattedTime": "09:10:19",
          "time": "2025-11-04T07:10:19.546Z",
          "isManual": true
        },
        {
          "id": "1762240226040",
          "content": "211381",
          "timestamp": "2025-11-04T07:10:26.033Z",
          "formattedTime": "09:10:26",
          "time": "2025-11-04T07:10:26.033Z",
          "isManual": true
        },
        {
          "id": "1762240234646",
          "content": "211747",
          "timestamp": "2025-11-04T07:10:34.639Z",
          "formattedTime": "09:10:34",
          "time": "2025-11-04T07:10:34.639Z",
          "isManual": true
        },
        {
          "id": "1762240238780",
          "content": "211540",
          "timestamp": "2025-11-04T07:10:38.774Z",
          "formattedTime": "09:10:38",
          "time": "2025-11-04T07:10:38.774Z",
          "isManual": true
        },
        {
          "id": "1762240250988",
          "content": "211716",
          "timestamp": "2025-11-04T07:10:50.982Z",
          "formattedTime": "09:10:50",
          "time": "2025-11-04T07:10:50.982Z",
          "isManual": true
        },
        {
          "id": "1762240256925",
          "content": "211632",
          "timestamp": "2025-11-04T07:10:56.919Z",
          "formattedTime": "09:10:56",
          "time": "2025-11-04T07:10:56.919Z",
          "isManual": true
        },
        {
          "id": "1762240266383",
          "content": "211842",
          "timestamp": "2025-11-04T07:11:06.376Z",
          "formattedTime": "09:11:06",
          "time": "2025-11-04T07:11:06.376Z",
          "isManual": true
        },
        {
          "id": "1762240280524",
          "content": "211669",
          "timestamp": "2025-11-04T07:11:20.517Z",
          "formattedTime": "09:11:20",
          "time": "2025-11-04T07:11:20.517Z",
          "isManual": true
        },
        {
          "id": "1762240285709",
          "content": "211707",
          "timestamp": "2025-11-04T07:11:25.704Z",
          "formattedTime": "09:11:25",
          "time": "2025-11-04T07:11:25.704Z",
          "isManual": true
        },
        {
          "id": "1762240297034",
          "content": "211597",
          "timestamp": "2025-11-04T07:11:37.028Z",
          "formattedTime": "09:11:37",
          "time": "2025-11-04T07:11:37.028Z",
          "isManual": true
        },
        {
          "id": "1762240302954",
          "content": "211626",
          "timestamp": "2025-11-04T07:11:42.948Z",
          "formattedTime": "09:11:42",
          "time": "2025-11-04T07:11:42.948Z",
          "isManual": true
        },
        {
          "id": "1762240310993",
          "content": "211914",
          "timestamp": "2025-11-04T07:11:50.986Z",
          "formattedTime": "09:11:50",
          "time": "2025-11-04T07:11:50.986Z",
          "isManual": true
        }
      ],
      "inProgress": true,
      "isScanner": true,
      "sessionType": "scanner",
      "recoveryStatus": "in_progress",
      "isChecklist": false,
      "backedUp": true,
      "user_email": "a4444b6514c91a6b1addfb4e79abf20b5f0433abc3dab51a28bd5736f4ec72c4",
      "user_id": "a4444b6514c91a6b1addfb4e79abf20b5f0433abc3dab51a28bd5736f4ec72c4_1763552756943",
      "created_by": "a4444b6514c91a6b1addfb4e79abf20b5f0433abc3dab51a28bd5736f4ec72c4",
      "created_at": "2025-11-19T11:45:56.943Z",
      "updated_at": "2025-11-19T11:45:56.943Z"
    },
    {
      "id": "scanner1762253663828",
      "location": "Physiology",
      "year": 2,
      "batch": "2025/2026",
      "dateTime": "2025-11-04T10:54:23.828Z",
      "formattedDateTime": "04/11/2025 12:54:23",
      "scans": [
        {
          "id": "1762253665328",
          "content": "241129",
          "timestamp": "2025-11-04T10:54:25.323Z",
          "formattedTime": "12:54:25",
          "time": "2025-11-04T10:54:25.323Z",
          "isManual": false
        },
        {
          "id": "1762253669062",
          "content": "241115",
          "timestamp": "2025-11-04T10:54:29.057Z",
          "formattedTime": "12:54:29",
          "time": "2025-11-04T10:54:29.057Z",
          "isManual": false
        },
        {
          "id": "1762253670219",
          "content": "241102",
          "timestamp": "2025-11-04T10:54:30.209Z",
          "formattedTime": "12:54:30",
          "time": "2025-11-04T10:54:30.209Z",
          "isManual": false
        },
        {
          "id": "1762253671850",
          "content": "241100",
          "timestamp": "2025-11-04T10:54:31.843Z",
          "formattedTime": "12:54:31",
          "time": "2025-11-04T10:54:31.843Z",
          "isManual": false
        },
        {
          "id": "1762253673098",
          "content": "241114",
          "timestamp": "2025-11-04T10:54:33.093Z",
          "formattedTime": "12:54:33",
          "time": "2025-11-04T10:54:33.093Z",
          "isManual": false
        },
        {
          "id": "1762253674889",
          "content": "241132",
          "timestamp": "2025-11-04T10:54:34.879Z",
          "formattedTime": "12:54:34",
          "time": "2025-11-04T10:54:34.879Z",
          "isManual": false
        },
        {
          "id": "1762253676269",
          "content": "241112",
          "timestamp": "2025-11-04T10:54:36.263Z",
          "formattedTime": "12:54:36",
          "time": "2025-11-04T10:54:36.263Z",
          "isManual": false
        },
        {
          "id": "1762253677239",
          "content": "241110",
          "timestamp": "2025-11-04T10:54:37.231Z",
          "formattedTime": "12:54:37",
          "time": "2025-11-04T10:54:37.231Z",
          "isManual": false
        },
        {
          "id": "1762253678524",
          "content": "241116",
          "timestamp": "2025-11-04T10:54:38.514Z",
          "formattedTime": "12:54:38",
          "time": "2025-11-04T10:54:38.514Z",
          "isManual": false
        },
        {
          "id": "1762253679500",
          "content": "241108",
          "timestamp": "2025-11-04T10:54:39.496Z",
          "formattedTime": "12:54:39",
          "time": "2025-11-04T10:54:39.496Z",
          "isManual": false
        },
        {
          "id": "1762253680858",
          "content": "241121",
          "timestamp": "2025-11-04T10:54:40.848Z",
          "formattedTime": "12:54:40",
          "time": "2025-11-04T10:54:40.848Z",
          "isManual": false
        },
        {
          "id": "1762253682797",
          "content": "241113",
          "timestamp": "2025-11-04T10:54:42.784Z",
          "formattedTime": "12:54:42",
          "time": "2025-11-04T10:54:42.784Z",
          "isManual": false
        },
        {
          "id": "1762253684327",
          "content": "241131",
          "timestamp": "2025-11-04T10:54:44.317Z",
          "formattedTime": "12:54:44",
          "time": "2025-11-04T10:54:44.317Z",
          "isManual": false
        },
        {
          "id": "1762253686031",
          "content": "241101",
          "timestamp": "2025-11-04T10:54:46.019Z",
          "formattedTime": "12:54:46",
          "time": "2025-11-04T10:54:46.019Z",
          "isManual": false
        }
      ],
      "inProgress": false,
      "isScanner": true,
      "sessionType": "scanner",
      "recoveryStatus": "closed_normally",
      "isChecklist": false,
      "backedUp": true,
      "user_email": "a4444b6514c91a6b1addfb4e79abf20b5f0433abc3dab51a28bd5736f4ec72c4",
      "user_id": "a4444b6514c91a6b1addfb4e79abf20b5f0433abc3dab51a28bd5736f4ec72c4_1763552756943",
      "created_by": "a4444b6514c91a6b1addfb4e79abf20b5f0433abc3dab51a28bd5736f4ec72c4",
      "created_at": "2025-11-19T11:45:56.943Z",
      "updated_at": "2025-11-19T11:45:56.943Z"
    },
    {
      "id": "scanner1762329051920",
      "location": "Physiology",
      "year": 2,
      "batch": "2025/2026",
      "dateTime": "2025-11-05T07:50:51.920Z",
      "formattedDateTime": "05/11/2025 09:50:51",
      "scans": [
        {
          "id": "1762329065249",
          "content": "241276",
          "timestamp": "2025-11-05T07:51:05.244Z",
          "formattedTime": "09:51:05",
          "time": "2025-11-05T07:51:05.244Z",
          "isManual": true
        },
        {
          "id": "1762329069092",
          "content": "241273",
          "timestamp": "2025-11-05T07:51:09.080Z",
          "formattedTime": "09:51:09",
          "time": "2025-11-05T07:51:09.080Z",
          "isManual": false
        },
        {
          "id": "1762329070397",
          "content": "241274",
          "timestamp": "2025-11-05T07:51:10.390Z",
          "formattedTime": "09:51:10",
          "time": "2025-11-05T07:51:10.390Z",
          "isManual": false
        },
        {
          "id": "1762329071854",
          "content": "241279",
          "timestamp": "2025-11-05T07:51:11.842Z",
          "formattedTime": "09:51:11",
          "time": "2025-11-05T07:51:11.842Z",
          "isManual": false
        },
        {
          "id": "1762329073065",
          "content": "241287",
          "timestamp": "2025-11-05T07:51:13.060Z",
          "formattedTime": "09:51:13",
          "time": "2025-11-05T07:51:13.060Z",
          "isManual": false
        },
        {
          "id": "1762329074872",
          "content": "241291",
          "timestamp": "2025-11-05T07:51:14.861Z",
          "formattedTime": "09:51:14",
          "time": "2025-11-05T07:51:14.861Z",
          "isManual": false
        },
        {
          "id": "1762329076043",
          "content": "241289",
          "timestamp": "2025-11-05T07:51:16.029Z",
          "formattedTime": "09:51:16",
          "time": "2025-11-05T07:51:16.029Z",
          "isManual": false
        },
        {
          "id": "1762329077440",
          "content": "241272",
          "timestamp": "2025-11-05T07:51:17.429Z",
          "formattedTime": "09:51:17",
          "time": "2025-11-05T07:51:17.429Z",
          "isManual": false
        },
        {
          "id": "1762329080561",
          "content": "241296",
          "timestamp": "2025-11-05T07:51:20.547Z",
          "formattedTime": "09:51:20",
          "time": "2025-11-05T07:51:20.547Z",
          "isManual": false
        },
        {
          "id": "1762329082395",
          "content": "241284",
          "timestamp": "2025-11-05T07:51:22.382Z",
          "formattedTime": "09:51:22",
          "time": "2025-11-05T07:51:22.382Z",
          "isManual": false
        },
        {
          "id": "1762329100915",
          "content": "241277",
          "timestamp": "2025-11-05T07:51:40.911Z",
          "formattedTime": "09:51:40",
          "time": "2025-11-05T07:51:40.911Z",
          "isManual": true
        }
      ],
      "inProgress": true,
      "isScanner": true,
      "sessionType": "scanner",
      "recoveryStatus": "in_progress",
      "isChecklist": false,
      "backedUp": true,
      "user_email": "a4444b6514c91a6b1addfb4e79abf20b5f0433abc3dab51a28bd5736f4ec72c4",
      "user_id": "a4444b6514c91a6b1addfb4e79abf20b5f0433abc3dab51a28bd5736f4ec72c4_1763552756943",
      "created_by": "a4444b6514c91a6b1addfb4e79abf20b5f0433abc3dab51a28bd5736f4ec72c4",
      "created_at": "2025-11-19T11:45:56.943Z",
      "updated_at": "2025-11-19T11:45:56.943Z"
    },
    {
      "id": "scanner1762329203018",
      "location": "Physiology",
      "year": 2,
      "batch": "2025/2026",
      "dateTime": "2025-11-05T07:53:23.018Z",
      "formattedDateTime": "05/11/2025 09:53:23",
      "scans": [
        {
          "id": "1762329208587",
          "content": "241281",
          "timestamp": "2025-11-05T07:53:28.582Z",
          "formattedTime": "09:53:28",
          "time": "2025-11-05T07:53:28.582Z",
          "isManual": true
        }
      ],
      "inProgress": false,
      "isScanner": true,
      "sessionType": "scanner",
      "recoveryStatus": "closed_normally",
      "isChecklist": false,
      "backedUp": true,
      "user_email": "a4444b6514c91a6b1addfb4e79abf20b5f0433abc3dab51a28bd5736f4ec72c4",
      "user_id": "a4444b6514c91a6b1addfb4e79abf20b5f0433abc3dab51a28bd5736f4ec72c4_1763552756943",
      "created_by": "a4444b6514c91a6b1addfb4e79abf20b5f0433abc3dab51a28bd5736f4ec72c4",
      "created_at": "2025-11-19T11:45:56.943Z",
      "updated_at": "2025-11-19T11:45:56.943Z"
    },
    {
      "id": "scanner1762332923329",
      "location": "Physiology",
      "year": 2,
      "batch": "2025/2026",
      "dateTime": "2025-11-05T08:55:23.329Z",
      "formattedDateTime": "05/11/2025 10:55:23",
      "scans": [
        {
          "id": "1762333039880",
          "content": "234936",
          "timestamp": "2025-11-05T08:57:19.875Z",
          "formattedTime": "10:57:19",
          "time": "2025-11-05T08:57:19.875Z",
          "isManual": true
        },
        {
          "id": "1762333045990",
          "content": "234928",
          "timestamp": "2025-11-05T08:57:25.981Z",
          "formattedTime": "10:57:25",
          "time": "2025-11-05T08:57:25.981Z",
          "isManual": true
        },
        {
          "id": "1762333052555",
          "content": "234921",
          "timestamp": "2025-11-05T08:57:32.551Z",
          "formattedTime": "10:57:32",
          "time": "2025-11-05T08:57:32.551Z",
          "isManual": true
        },
        {
          "id": "1762333062123",
          "content": "234888",
          "timestamp": "2025-11-05T08:57:42.111Z",
          "formattedTime": "10:57:42",
          "time": "2025-11-05T08:57:42.111Z",
          "isManual": false
        },
        {
          "id": "1762333063083",
          "content": "234896",
          "timestamp": "2025-11-05T08:57:43.073Z",
          "formattedTime": "10:57:43",
          "time": "2025-11-05T08:57:43.073Z",
          "isManual": false
        },
        {
          "id": "1762333064336",
          "content": "234889",
          "timestamp": "2025-11-05T08:57:44.325Z",
          "formattedTime": "10:57:44",
          "time": "2025-11-05T08:57:44.325Z",
          "isManual": false
        },
        {
          "id": "1762333065703",
          "content": "234844",
          "timestamp": "2025-11-05T08:57:45.692Z",
          "formattedTime": "10:57:45",
          "time": "2025-11-05T08:57:45.692Z",
          "isManual": false
        },
        {
          "id": "1762333065896",
          "content": "234863",
          "timestamp": "2025-11-05T08:57:45.892Z",
          "formattedTime": "10:57:45",
          "time": "2025-11-05T08:57:45.892Z",
          "isManual": false
        },
        {
          "id": "1762333067186",
          "content": "234948",
          "timestamp": "2025-11-05T08:57:47.176Z",
          "formattedTime": "10:57:47",
          "time": "2025-11-05T08:57:47.176Z",
          "isManual": false
        }
      ],
      "inProgress": false,
      "isScanner": true,
      "sessionType": "scanner",
      "recoveryStatus": "closed_normally",
      "isChecklist": false,
      "backedUp": true,
      "user_email": "a4444b6514c91a6b1addfb4e79abf20b5f0433abc3dab51a28bd5736f4ec72c4",
      "user_id": "a4444b6514c91a6b1addfb4e79abf20b5f0433abc3dab51a28bd5736f4ec72c4_1763552756943",
      "created_by": "a4444b6514c91a6b1addfb4e79abf20b5f0433abc3dab51a28bd5736f4ec72c4",
      "created_at": "2025-11-19T11:45:56.943Z",
      "updated_at": "2025-11-19T11:45:56.943Z"
    },
    {
      "id": "scanner1762423151623",
      "location": "Physiology",
      "year": 2,
      "batch": "2025/2026",
      "dateTime": "2025-11-06T09:59:11.623Z",
      "formattedDateTime": "06/11/2025 11:59:11",
      "scans": [
        {
          "id": "1762423159686",
          "content": "241666",
          "timestamp": "2025-11-06T09:59:19.680Z",
          "formattedTime": "11:59:19",
          "time": "2025-11-06T09:59:19.680Z",
          "isManual": true
        },
        {
          "id": "1762423165463",
          "content": "241669",
          "timestamp": "2025-11-06T09:59:25.458Z",
          "formattedTime": "11:59:25",
          "time": "2025-11-06T09:59:25.458Z",
          "isManual": true
        },
        {
          "id": "1762423176203",
          "content": "231340",
          "timestamp": "2025-11-06T09:59:36.198Z",
          "formattedTime": "11:59:36",
          "time": "2025-11-06T09:59:36.198Z",
          "isManual": true
        },
        {
          "id": "1762423196606",
          "content": "241619",
          "timestamp": "2025-11-06T09:59:56.597Z",
          "formattedTime": "11:59:56",
          "time": "2025-11-06T09:59:56.597Z",
          "isManual": true
        },
        {
          "id": "1762423214395",
          "content": "241510",
          "timestamp": "2025-11-06T10:00:14.389Z",
          "formattedTime": "12:00:14",
          "time": "2025-11-06T10:00:14.389Z",
          "isManual": true
        },
        {
          "id": "1762423224182",
          "content": "241526",
          "timestamp": "2025-11-06T10:00:24.178Z",
          "formattedTime": "12:00:24",
          "time": "2025-11-06T10:00:24.178Z",
          "isManual": true
        },
        {
          "id": "1762423233889",
          "content": "241582",
          "timestamp": "2025-11-06T10:00:33.884Z",
          "formattedTime": "12:00:33",
          "time": "2025-11-06T10:00:33.884Z",
          "isManual": true
        },
        {
          "id": "1762423240109",
          "content": "241585",
          "timestamp": "2025-11-06T10:00:40.104Z",
          "formattedTime": "12:00:40",
          "time": "2025-11-06T10:00:40.104Z",
          "isManual": true
        },
        {
          "id": "1762423248465",
          "content": "241591",
          "timestamp": "2025-11-06T10:00:48.459Z",
          "formattedTime": "12:00:48",
          "time": "2025-11-06T10:00:48.459Z",
          "isManual": true
        },
        {
          "id": "1762423254804",
          "content": "241600",
          "timestamp": "2025-11-06T10:00:54.797Z",
          "formattedTime": "12:00:54",
          "time": "2025-11-06T10:00:54.797Z",
          "isManual": true
        },
        {
          "id": "1762423260289",
          "content": "241607",
          "timestamp": "2025-11-06T10:01:00.284Z",
          "formattedTime": "12:01:00",
          "time": "2025-11-06T10:01:00.284Z",
          "isManual": true
        }
      ],
      "inProgress": false,
      "isScanner": true,
      "sessionType": "scanner",
      "recoveryStatus": "closed_normally",
      "isChecklist": false,
      "backedUp": true,
      "user_email": "a4444b6514c91a6b1addfb4e79abf20b5f0433abc3dab51a28bd5736f4ec72c4",
      "user_id": "a4444b6514c91a6b1addfb4e79abf20b5f0433abc3dab51a28bd5736f4ec72c4_1763552756943",
      "created_by": "a4444b6514c91a6b1addfb4e79abf20b5f0433abc3dab51a28bd5736f4ec72c4",
      "created_at": "2025-11-19T11:45:56.943Z",
      "updated_at": "2025-11-19T11:45:56.943Z"
    },
    {
      "id": "scanner1762673152310",
      "location": "Physiology",
      "year": 3,
      "batch": "2025/2026",
      "dateTime": "2025-11-09T07:25:52.310Z",
      "formattedDateTime": "09/11/2025 09:25:52",
      "scans": [
        {
          "id": "1762673182968",
          "content": "180538",
          "timestamp": "2025-11-09T07:26:22.962Z",
          "formattedTime": "09:26:22",
          "time": "2025-11-09T07:26:22.962Z",
          "isManual": true
        },
        {
          "id": "1762673201658",
